00398053,220009000047,LOWERY ELEMENTARY SCHOOL,00398027,ASCENSION PARISH SCHOOLS,75%+ (High),"$37K-38,999",3,5,No,No,Donaldsonvlle,Ascension,LA,70346
01446926,,ALEXANDRIA COUNTRY DAY SCHOOL,,,,"$48K-51,999",,8,No,No,Alexandria,Rapides,LA,71303
00406131,220096000735,NEBO ELEMENTARY SCHOOL,00406064,LASALLE PARISH SCHOOL DIST,40-75% (Mid-High),"$32K-34,999",,8,No,No,Jena,La Salle,LA,71342
00401167,220054000349,BELAIRE HIGH SCHOOL,00401064,EAST BATON ROUGE PARISH SD,75%+ (High),"$55K-59,999",9,12,No,No,Baton Rouge,East Baton Rouge,LA,70815
00410819,220129001040,ALEXANDRIA SENIOR HIGH SCHOOL,00410766,RAPIDES PARISH SCHOOL DISTRICT,40-75% (Mid-High),"$48K-51,999",9,12,No,No,Alexandria,Rapides,LA,71303
00405618,,ST JOHN ELEMENTARY SCHOOL,00405175,DIOCESE OF LAFAYETTE ED OFFICE,,"$41K-42,999",,5,No,No,Franklin,St Mary,LA,70538
00411241,220129001044,SCOTT M BRAME MIDDLE SCHOOL,00410766,RAPIDES PARISH SCHOOL DISTRICT,40-75% (Mid-High),"$32K-34,999",6,8,No,No,Alexandria,Rapides,LA,71301
04807692,,BEAUREGARD ALTERNATIVE SCHOOL,00398443,BEAUREGARD PARISH SCHOOL DIST,,"$52K-54,999",6,12,No,No,Deridder,Beauregard,LA,70634
00406997,220114000836,NSU ELEMENTARY LAB SCHOOL,00406820,NATCHITOCHES PARISH SCH DIST,0-40% (Low),,,5,No,Yes,Natchitoches,Natchitoches,LA,71497
00414126,220168001310,KENTWOOD HIGH MAGNET SCHOOL,00413976,TANGIPAHOA PARISH SCHOOL DIST,40-75% (Mid-High),"$32K-34,999",7,12,No,No,Kentwood,Tangipahoa,LA,70444
00398869,220027000131,CARRIE MARTIN ELEM SCHOOL,00398687,BOSSIER PARISH SCHOOL DIST,75%+ (High),"$32K-34,999",,,No,No,Plain Dealing,Bossier,LA,71064
00405852,220090000707,GOLDEN MEADOW LOWER ELEM SCH,00405747,LAFOURCHE PARISH SCHOOL DIST,75%+ (High),"$52K-54,999",,2,No,No,Golden Meadow,Lafourche,LA,70357
00397803,220003000012,EVANGELINE ELEMENTARY SCHOOL,00397683,ACADIA PARISH SCHOOL DISTRICT,0-40% (Low),"$45K-47,999",,8,No,No,Evangeline,Acadia,LA,70537
00402408,,ST ALOYSIUS SCHOOL,00402226,DIOCESE OF BATON ROUGE ED OFF,,"$70K-80,999",,8,No,No,Baton Rouge,East Baton Rouge,LA,70808
00403505,220075000543,PLAQUEMINE HIGH SCHOOL,00403414,IBERVILLE PARISH SCHOOL DIST,40-75% (Mid-High),"$52K-54,999",7,12,No,No,Plaquemine,Iberville,LA,70764
11927443,220021102307,KIPP LEADERSHIP PRIMARY,11916250,KIPP NEW ORLEANS SCHOOLS,75%+ (High),"$28K-31,999",,4,Yes,No,New Orleans,Orleans,LA,70117
03422689,,BOUTTE CHRISTIAN ACADEMY,,,,"$55K-59,999",,8,No,No,Boutte,St Charles,LA,70039
00411409,,OUR LADY OF FATIMA SCHOOL,02906084,DIOCESE OF SHREVEPORT ED OFF,,"$48K-51,999",,6,No,No,Monroe,Ouachita,LA,71201
10029725,,LUSHER CHARTER MIDDLE HIGH SCH,00407068,ORLEANS PARISH SCHOOL DISTRICT,,"$60K-64,999",6,12,Yes,No,New Orleans,Orleans,LA,70115
00406985,220114000834,NATCHITOCHES CENTRAL HIGH SCH,00406820,NATCHITOCHES PARISH SCH DIST,40-75% (Mid-High),"$28K-31,999",9,12,No,No,Natchitoches,Natchitoches,LA,71457
00415871,220195001472,OAK GROVE HIGH SCHOOL,00415819,WEST CARROLL PARISH SCH DIST,75%+ (High),"$43K-44,999",6,12,No,No,Oak Grove,West Carroll,LA,71263
00413213,220159001221,CECILIA JUNIOR HIGH SCHOOL,00413158,ST MARTIN PARISH SCHOOL DIST,40-75% (Mid-High),,6,8,No,No,Cecilia,St Martin,LA,70521
11229174,,GRACE BAPTIST ACADEMY,,,,"$48K-51,999",,12,No,No,Marrero,Jefferson,LA,70072
00399746,220033000216,ALFRED M BARBE HIGH SCHOOL,00399722,CALCASIEU PARISH PUBLIC SCH,0-40% (Low),"$70K-80,999",9,12,No,No,Lake Charles,Calcasieu,LA,70605
00400424,220036000281,CALDWELL PARISH HIGH SCHOOL,00400412,CALDWELL PARISH SCHOOL DIST,40-75% (Mid-High),"$32K-34,999",9,12,No,No,Columbia,Caldwell,LA,71418
00410156,220108000799,NEVILLE HIGH SCHOOL,00410027,MONROE CITY SCHOOL DISTRICT,40-75% (Mid-High),"$48K-51,999",9,12,No,No,Monroe,Ouachita,LA,71201
00408921,,HOLY SAVIOR ELEMENTARY SCHOOL,01600641,DIOCESE HOUMA-THIBODAUX ED OFF,,"$60K-64,999",,8,No,No,Lockport,Lafourche,LA,70374
00408983,,ST JOAN OF ARC SCHOOL,00408658,ARCHDIOCESE NEW ORLEANS ED OFF,,"$45K-47,999",,8,No,No,New Orleans,Orleans,LA,70118
00407989,,EDNA KARR HIGH SCHOOL,12179039,INSPIRENOLA CHARTER SCHOOLS,,"$48K-51,999",9,12,Yes,No,New Orleans,Orleans,LA,70131
00405876,220090000711,LAROSE-CUT OFF MIDDLE SCHOOL,00405747,LAFOURCHE PARISH SCHOOL DIST,40-75% (Mid-High),"$52K-54,999",6,8,No,No,Larose,Lafourche,LA,70373
00405436,,OUR LADY QUEEN OF HEAVEN SCH,02113639,DIOCESE OF LAKE CHARLES ED OFF,,"$70K-80,999",,8,No,No,Lake Charles,Calcasieu,LA,70605
04921858,220003601499,NEW ORLEANS CTR/CREATIVE ARTS,00397671,LOUISIANA DEPT OF EDUCATION,0-40% (Low),"$28K-31,999",9,12,No,No,New Orleans,Orleans,LA,70117
00399423,220030000182,NORTHWOOD HIGH SCHOOL,00398962,CADDO PARISH PUBLIC SCHOOLS,40-75% (Mid-High),"$32K-34,999",9,12,No,No,Shreveport,Caddo,LA,71107
11560021,220020700972,LB LANDRY-OP WALKER CLG PREP,11913430,ALGIERS CHARTER SCHOOL ASSOC,0-40% (Low),"$28K-31,999",9,12,Yes,No,New Orleans,Orleans,LA,70114
04371021,,LAKE CASTLE SCHOOL,,,,$94K+,,8,No,No,Madisonville,St Tammany,LA,70447
02957203,,CEDARWOOD SCHOOL,,,,"$81K-93,999",,7,No,No,Mandeville,St Tammany,LA,70471
00415998,220201001481,WINNFIELD EARLY CHILDHOOD CTR,00415950,WINN PARISH SCHOOL DISTRICT,75%+ (High),"$28K-31,999",,,No,No,Winnfield,Winn,LA,71483
01171092,220174001653,SCHOOL FOR EXCEPTIONAL CHLDRN,00414384,TERREBONNE PARISH SCHOOL DIST,40-75% (Mid-High),"$28K-31,999",,,No,No,Houma,Terrebonne,LA,70363
11927431,,KIPP MORIAL MIDDLE SCH,11916250,KIPP NEW ORLEANS SCHOOLS,,"$1–27,999",6,8,Yes,No,New Orleans,Orleans,LA,70126
00398742,220027000117,BENTON HIGH SCHOOL,00398687,BOSSIER PARISH SCHOOL DIST,0-40% (Low),"$60K-64,999",9,12,No,No,Benton,Bossier,LA,71006
01446653,,ARDEN CAHILL ACADEMY,,,,"$55K-59,999",,10,No,No,Gretna,Jefferson,LA,70056
00411916,220138001113,MANY JUNIOR HIGH SCHOOL,00411851,SABINE PARISH SCHOOL DISTRICT,40-75% (Mid-High),"$45K-47,999",5,8,No,No,Many,Sabine,LA,71449
00412788,220156001178,EAST ELEMENTARY SCHOOL,00412702,ST LANDRY PARISH SCH DIST,40-75% (Mid-High),"$39K-40,999",,4,No,Yes,Eunice,St Landry,LA,70535
00412805,220156001180,EUNICE ELEMENTARY SCHOOL,00412702,ST LANDRY PARISH SCH DIST,40-75% (Mid-High),"$39K-40,999",,4,No,Yes,Eunice,St Landry,LA,70535
01808764,220144001633,LAKEWOOD ELEMENTARY SCHOOL,00412154,ST CHARLES PARISH PUBLIC SD,40-75% (Mid-High),"$81K-93,999",3,5,No,No,Luling,St Charles,LA,70070
00405802,220090000702,CUT OFF ELEMENTARY SCHOOL,00405747,LAFOURCHE PARISH SCHOOL DIST,40-75% (Mid-High),"$55K-59,999",,5,No,No,Cut Off,Lafourche,LA,70345
00398845,220027000129,MEADOWVIEW ELEMENTARY SCHOOL,00398687,BOSSIER PARISH SCHOOL DIST,40-75% (Mid-High),"$48K-51,999",,5,No,Yes,Bossier City,Bossier,LA,71111
01171016,220174001354,LACACHE MIDDLE SCHOOL,00414384,TERREBONNE PARISH SCHOOL DIST,0-40% (Low),"$32K-34,999",5,8,No,No,Chauvin,Terrebonne,LA,70344
12037912,220021902395,IBERVILLE CHARTER ACADEMY,11914678,CHARTER SCHOOLS USA,0-40% (Low),"$52K-54,999",,8,Yes,Yes,Plaquemine,Iberville,LA,70764
12044745,220023102392,LAFAYETTE RENAISSANCE ACADEMY,11914678,CHARTER SCHOOLS USA,0-40% (Low),"$43K-44,999",,8,Yes,No,Lafayette,Lafayette,LA,70507
00402745,220060000468,SLAUGHTER ELEMENTARY SCHOOL,00402642,EAST FELICIANA PARISH SCH DIST,40-75% (Mid-High),"$60K-64,999",,6,No,Yes,Slaughter,East Feliciana,LA,70777
00403191,220072000510,COTEAU ELEMENTARY SCHOOL,00403139,IBERIA PARISH SCHOOL DISTRICT,40-75% (Mid-High),"$35K-36,999",,6,No,No,New Iberia,Iberia,LA,70560
05110208,220004101630,BELLE CHASSE ACADEMY,00397671,LOUISIANA DEPT OF EDUCATION,40-75% (Mid-High),"$60K-64,999",,8,Yes,No,Belle Chasse,Plaquemines,LA,70037
01520314,220192001458,BRUSLY MIDDLE SCHOOL,00415730,WEST BATON ROUGE PARISH SD,40-75% (Mid-High),$94K+,6,8,No,No,Brusly,West Baton Rouge,LA,70719
03050482,220030001918,KEITHVILLE ELEM MIDDLE SCHOOL,00398962,CADDO PARISH PUBLIC SCHOOLS,40-75% (Mid-High),"$52K-54,999",,8,No,Yes,Keithville,Caddo,LA,71047
00402666,220060000459,CLINTON ELEMENTARY SCHOOL,00402642,EAST FELICIANA PARISH SCH DIST,75%+ (High),"$48K-51,999",,5,No,Yes,Clinton,East Feliciana,LA,70722
00399590,220030000200,SUMMERFIELD ELEMENTARY SCHOOL,00398962,CADDO PARISH PUBLIC SCHOOLS,40-75% (Mid-High),"$41K-42,999",,5,No,Yes,Shreveport,Caddo,LA,71118
00404781,220087000662,ALICE BOUCHER ELEM SCHOOL,00404755,LAFAYETTE PARISH SCH DISTRICT,75%+ (High),"$1–27,999",,5,No,Yes,Lafayette,Lafayette,LA,70501
01170854,220174001334,ACADIAN ELEMENTARY SCHOOL,00414384,TERREBONNE PARISH SCHOOL DIST,40-75% (Mid-High),"$28K-31,999",,4,No,No,Houma,Terrebonne,LA,70363
10914039,220020600976,LANGSTON HUGHES ACADEMY,11912369,FIRSTLINE SCHOOLS INC,40-75% (Mid-High),"$35K-36,999",,8,Yes,Yes,New Orleans,Orleans,LA,70119
02126313,220183001665,ROSEPINE ELEMENTARY SCHOOL,00415089,VERNON PARISH SCHOOL DISTRICT,40-75% (Mid-High),,,6,No,No,Rosepine,Vernon,LA,70659
00412063,220141001127,J F GAUTHIER ELEMENTARY SCHOOL,00411978,ST BERNARD PARISH SCHOOL DIST,40-75% (Mid-High),"$48K-51,999",,5,No,Yes,Saint Bernard,St Bernard,LA,70085
00399344,,LINWOOD PUBLIC CHARTER SCHOOL,10029737,RECOVERY SCHOOL DISTRICT,,"$48K-51,999",,8,Yes,Yes,Shreveport,Caddo,LA,71106
00415106,220183001406,EAST LEESVILLE ELEM SCHOOL,00415089,VERNON PARISH SCHOOL DISTRICT,75%+ (High),"$48K-51,999",,1,No,No,Leesville,Vernon,LA,71446
03337747,220168001991,WOODLAND PARK MAGNET SCH,00413976,TANGIPAHOA PARISH SCHOOL DIST,75%+ (High),"$48K-51,999",,6,No,Yes,Hammond,Tangipahoa,LA,70403
00407070,,BENJAMIN FRANKLIN HIGH SCHOOL,00407068,ORLEANS PARISH SCHOOL DISTRICT,,"$39K-40,999",9,12,Yes,No,New Orleans,Orleans,LA,70122
00399875,220033000228,DOLBY ELEMENTARY SCHOOL,00399722,CALCASIEU PARISH PUBLIC SCH,40-75% (Mid-High),"$70K-80,999",,5,No,No,Lake Charles,Calcasieu,LA,70605
00403311,220072002078,MAGNOLIA ELEMENTARY SCHOOL,00403139,IBERIA PARISH SCHOOL DISTRICT,75%+ (High),"$35K-36,999",,6,No,No,New Iberia,Iberia,LA,70560
00399394,220030000180,NORTH HIGHLANDS ELEMENTARY,00398962,CADDO PARISH PUBLIC SCHOOLS,40-75% (Mid-High),"$32K-34,999",,5,No,Yes,Shreveport,Caddo,LA,71107
01524530,220162001255,PATTERSON JUNIOR HIGH SCHOOL,00413328,ST MARY PARISH SCHOOL DISTRICT,40-75% (Mid-High),"$45K-47,999",5,8,No,Yes,Patterson,St Mary,LA,70392
00412477,220150001165,PAULINA ELEMENTARY SCHOOL,00412415,ST JAMES PARISH SCHOOL DIST,40-75% (Mid-High),"$70K-80,999",,3,No,No,Paulina,St James,LA,70763
00402848,220063000475,MAMOU HIGH SCHOOL,00402769,EVANGELINE PARISH SCHOOL DIST,40-75% (Mid-High),"$32K-34,999",5,12,No,Yes,Mamou,Evangeline,LA,70554
10030542,220022702018,LIVE OAK ACADEMY,11912369,FIRSTLINE SCHOOLS INC,75%+ (High),"$60K-64,999",,8,Yes,No,New Orleans,Orleans,LA,70115
10914077,,ANDREW WILSON CHARTER SCHOOL,12179039,INSPIRENOLA CHARTER SCHOOLS,,"$39K-40,999",,8,Yes,Yes,New Orleans,Orleans,LA,70125
00402161,220003900449,ZACHARY ELEMENTARY SCHOOL,05256917,ZACHARY COMMUNITY SCHOOL DIST,40-75% (Mid-High),"$70K-80,999",3,4,No,Yes,Zachary,East Baton Rouge,LA,70791
00412439,220150001161,GRAMERCY ELEMENTARY SCHOOL,00412415,ST JAMES PARISH SCHOOL DIST,40-75% (Mid-High),"$60K-64,999",4,6,No,No,Gramercy,St James,LA,70052
11550789,220020302297,MORRIS JEFF COMMUNITY SCHOOL,00407068,ORLEANS PARISH SCHOOL DISTRICT,40-75% (Mid-High),,,12,Yes,Yes,New Orleans,Orleans,LA,70179
00398730,220027000116,BENTON ELEMENTARY SCHOOL,00398687,BOSSIER PARISH SCHOOL DIST,0-40% (Low),"$60K-64,999",,5,No,Yes,Benton,Bossier,LA,71006
00398754,220027000118,BOSSIER ELEMENTARY SCHOOL,00398687,BOSSIER PARISH SCHOOL DIST,75%+ (High),"$48K-51,999",,5,No,Yes,Bossier City,Bossier,LA,71111
12310221,,HAUGHTON ELEMENTARY SCHOOL,00398687,BOSSIER PARISH SCHOOL DIST,,"$48K-51,999",,5,No,Yes,Haughton,Bossier,LA,71037
00399306,220030000171,JUDSON FUNDAMENTAL MAGNET SCH,00398962,CADDO PARISH PUBLIC SCHOOLS,40-75% (Mid-High),"$1–27,999",,5,No,Yes,Shreveport,Caddo,LA,71109
00404884,220087000672,J W FAULK ELEMENTARY SCHOOL,00404755,LAFAYETTE PARISH SCH DISTRICT,75%+ (High),"$1–27,999",,5,No,Yes,Lafayette,Lafayette,LA,70501
00415780,220192000419,BRUSLY ELEMENTARY SCHOOL,00415730,WEST BATON ROUGE PARISH SD,40-75% (Mid-High),$94K+,,2,No,Yes,Brusly,West Baton Rouge,LA,70719
00404418,220084000644,TOM BENSON SCHOOL,00403713,JEFFERSON PARISH PUB SCH DIST,40-75% (Mid-High),"$60K-64,999",,8,No,Yes,Kenner,Jefferson,LA,70065
00414279,220168001325,MARTHA VINYARD ELEM SCHOOL,00413976,TANGIPAHOA PARISH SCHOOL DIST,0-40% (Low),"$60K-64,999",5,6,No,Yes,Ponchatoula,Tangipahoa,LA,70454
00413627,220162001262,WYANDOTTE ELEMENTARY SCHOOL,00413328,ST MARY PARISH SCHOOL DISTRICT,40-75% (Mid-High),"$39K-40,999",,5,No,Yes,Morgan City,St Mary,LA,70380
00410235,220120000998,BOLEY ELEMENTARY SCHOOL,00410211,OUACHITA PARISH SCHOOL DIST,40-75% (Mid-High),"$48K-51,999",,5,No,No,West Monroe,Ouachita,LA,71291
02126301,220183001412,PICKERING ELEMENTARY SCHOOL,00415089,VERNON PARISH SCHOOL DISTRICT,40-75% (Mid-High),"$48K-51,999",,6,No,No,Leesville,Vernon,LA,71446
00413861,220165001286,MANDEVILLE MIDDLE SCHOOL,00413639,ST TAMMANY PARISH SCH DISTRICT,0-40% (Low),"$81K-93,999",4,6,No,No,Mandeville,St Tammany,LA,70448
00406909,,FAIRVIEW ALPHA ELEMENTARY SCH,00406820,NATCHITOCHES PARISH SCH DIST,,"$28K-31,999",,6,No,Yes,Campti,Natchitoches,LA,71411
00400084,220033000252,MOSS BLUFF ELEMENTARY SCHOOL,00399722,CALCASIEU PARISH PUBLIC SCH,40-75% (Mid-High),"$70K-80,999",,5,No,Yes,Lake Charles,Calcasieu,LA,70611
11548968,220141002302,ARABI ELEMENTARY SCHOOL,00411978,ST BERNARD PARISH SCHOOL DIST,40-75% (Mid-High),"$45K-47,999",,5,No,Yes,Arabi,St Bernard,LA,70032
01170907,220174001339,BROADMOOR ELEMENTARY SCHOOL,00414384,TERREBONNE PARISH SCHOOL DIST,40-75% (Mid-High),"$45K-47,999",,6,No,No,Houma,Terrebonne,LA,70364
00397839,220003000015,MERMENTAU ELEMENTARY SCHOOL,00397683,ACADIA PARISH SCHOOL DISTRICT,40-75% (Mid-High),"$45K-47,999",,7,No,No,Mermentau,Acadia,LA,70556
02177178,220159001645,EARLY LEARNING CENTER,00413158,ST MARTIN PARISH SCHOOL DIST,40-75% (Mid-High),"$45K-47,999",,1,No,No,St Martinvlle,St Martin,LA,70582
00402135,220054000446,WINBOURNE ELEMENTARY SCHOOL,00401064,EAST BATON ROUGE PARISH SD,75%+ (High),"$28K-31,999",,5,No,Yes,Baton Rouge,East Baton Rouge,LA,70805
00409937,,ST STEPHEN CATHOLIC SCHOOL,00408658,ARCHDIOCESE NEW ORLEANS ED OFF,,"$60K-64,999",,7,No,No,New Orleans,Orleans,LA,70115
12306232,,GEO PREP MID-CITY CHARTER SCH,11913246,GEO FOUNDATION,,"$43K-44,999",,8,Yes,Yes,Baton Rouge,East Baton Rouge,LA,70806
00412661,220153001836,WEST ST JOHN ELEMENTARY SCHOOL,00412556,ST JOHN THE BAPTIST PARISH SD,40-75% (Mid-High),"$37K-38,999",,7,No,Yes,Edgard,St John The Baptist,LA,70049
00403294,220072000522,LOREAUVILLE ELEMENTARY SCHOOL,00403139,IBERIA PARISH SCHOOL DISTRICT,0-40% (Low),"$41K-42,999",,6,No,No,Loreauville,Iberia,LA,70552
03251351,220165001950,WHISPERING FOREST ELEM SCHOOL,00413639,ST TAMMANY PARISH SCH DISTRICT,40-75% (Mid-High),"$60K-64,999",,3,No,Yes,Slidell,St Tammany,LA,70458
00402812,220063000471,BAYOU CHICOT ELEMENTARY SCHOOL,00402769,EVANGELINE PARISH SCHOOL DIST,40-75% (Mid-High),"$32K-34,999",,8,No,Yes,Ville Platte,Evangeline,LA,70586
00414085,220168001308,INDEPENDENCE MAGNET SCH,00413976,TANGIPAHOA PARISH SCHOOL DIST,40-75% (Mid-High),"$39K-40,999",5,8,No,Yes,Independence,Tangipahoa,LA,70443
00410132,220108000798,ROY NEAL SHELLING SR ELEM SCH,00410027,MONROE CITY SCHOOL DISTRICT,75%+ (High),"$45K-47,999",,6,No,Yes,Monroe,Ouachita,LA,71203
01845750,220165001283,MADISONVILLE ELEMENTARY SCHOOL,00413639,ST TAMMANY PARISH SCH DISTRICT,0-40% (Low),$94K+,,2,No,No,Madisonville,St Tammany,LA,70447
00400345,220033000235,W T HENNING ELEMENTARY SCHOOL,00399722,CALCASIEU PARISH PUBLIC SCH,0-40% (Low),"$60K-64,999",,5,No,Yes,Sulphur,Calcasieu,LA,70663
00412295,220144001149,ALBERT CAMMON MIDDLE SCHOOL,00412154,ST CHARLES PARISH PUBLIC SD,40-75% (Mid-High),"$48K-51,999",6,8,No,No,Saint Rose,St Charles,LA,70087
00413823,220165001282,LYON ELEMENTARY SCHOOL,00413639,ST TAMMANY PARISH SCH DISTRICT,40-75% (Mid-High),"$70K-80,999",,3,No,No,Covington,St Tammany,LA,70433
01252555,220174001341,COTEAU-BAYOU BLUE ELEM SCHOOL,00414384,TERREBONNE PARISH SCHOOL DIST,40-75% (Mid-High),"$45K-47,999",,6,No,No,Houma,Terrebonne,LA,70364
04871552,220087001173,ERNEST GALLET ELEMENTARY SCH,00404755,LAFAYETTE PARISH SCH DISTRICT,0-40% (Low),"$70K-80,999",,5,No,Yes,Youngsville,Lafayette,LA,70592
00399734,220033000255,A A NELSON ELEMENTARY SCHOOL,00399722,CALCASIEU PARISH PUBLIC SCH,40-75% (Mid-High),"$70K-80,999",,5,No,No,Lake Charles,Calcasieu,LA,70605
00399679,220030000211,WESTWOOD ELEMENTARY SCHOOL,00398962,CADDO PARISH PUBLIC SCHOOLS,75%+ (High),"$28K-31,999",,5,No,Yes,Shreveport,Caddo,LA,71108
00398704,220027000113,APOLLO ELEMENTARY SCHOOL,00398687,BOSSIER PARISH SCHOOL DIST,40-75% (Mid-High),"$48K-51,999",,5,No,Yes,Bossier City,Bossier,LA,71111
00398883,220027000133,PLANTATION PARK ELEM SCHOOL,00398687,BOSSIER PARISH SCHOOL DIST,40-75% (Mid-High),"$48K-51,999",,5,No,Yes,Bossier City,Bossier,LA,71111
12038136,220054002353,MAYFAIR LABORATORY SCHOOL,00401064,EAST BATON ROUGE PARISH SD,0-40% (Low),$94K+,,8,No,Yes,Baton Rouge,East Baton Rouge,LA,70810
00414803,220177001694,UNION PARISH ELEM SCHOOL,00414774,UNION PARISH SCHOOL DISTRICT,75%+ (High),"$45K-47,999",,5,No,Yes,Farmerville,Union,LA,71241
02906993,220009001863,LAKE ELEMENTARY SCHOOL,00398027,ASCENSION PARISH SCHOOLS,0-40% (Low),"$70K-80,999",,8,No,No,Saint Amant,Ascension,LA,70774
00404494,220084000615,WILLIAM HART ELEMENTARY SCHOOL,00403713,JEFFERSON PARISH PUB SCH DIST,40-75% (Mid-High),"$41K-42,999",,5,No,Yes,Gretna,Jefferson,LA,70053
00406600,220105000781,TALLULAH ELEMENTARY SCHOOL,00406569,MADISON PARISH SCHOOL DIST,75%+ (High),"$32K-34,999",,3,No,Yes,Tallulah,Madison,LA,71282
04017445,220195002011,OAK GROVE ELEMENTARY SCHOOL,00415819,WEST CARROLL PARISH SCH DIST,75%+ (High),"$43K-44,999",,5,No,No,Oak Grove,West Carroll,LA,71263
12364507,,BELLE PLACE ELEMENTARY SCHOOL,00403139,IBERIA PARISH SCHOOL DISTRICT,,"$48K-51,999",,6,No,No,New Iberia,Iberia,LA,70563
00409119,,OUR LADY OF PROMPT SUCCOR SCH,00408658,ARCHDIOCESE NEW ORLEANS ED OFF,,"$37K-38,999",,8,No,No,Westwego,Jefferson,LA,70094
00399203,220030000162,FOREST HILL ELEMENTARY SCHOOL,00398962,CADDO PARISH PUBLIC SCHOOLS,40-75% (Mid-High),"$41K-42,999",,5,No,Yes,Shreveport,Caddo,LA,71118
00401296,220054000362,CEDARCREST-SOUTHMOOR ELEM SCH,00401064,EAST BATON ROUGE PARISH SD,40-75% (Mid-High),"$60K-64,999",,5,No,Yes,Baton Rouge,East Baton Rouge,LA,70816
03007071,220084001813,JOSHUA BUTLER ELEM SCHOOL,00403713,JEFFERSON PARISH PUB SCH DIST,40-75% (Mid-High),"$37K-38,999",,5,No,Yes,Westwego,Jefferson,LA,70094
00399849,220033002292,DEQUINCY ELEMENTARY SCHOOL,00399722,CALCASIEU PARISH PUBLIC SCH,0-40% (Low),"$52K-54,999",3,5,No,No,Dequincy,Calcasieu,LA,70633
00402044,220054000436,UNIVERSITY TERRACE ELEM SCHOOL,00401064,EAST BATON ROUGE PARISH SD,75%+ (High),"$28K-31,999",,5,No,Yes,Baton Rouge,East Baton Rouge,LA,70802
00410883,220129001054,D F HUDDLE ELEMENTARY SCHOOL,00410766,RAPIDES PARISH SCHOOL DISTRICT,75%+ (High),"$32K-34,999",,,No,No,Alexandria,Rapides,LA,71301
12368876,,EMMETT GILBERT SCH EXCELLENCE,00403713,JEFFERSON PARISH PUB SCH DIST,,"$37K-38,999",,8,No,Yes,Westwego,Jefferson,LA,70094
01556246,220174001342,DULARGE ELEMENTARY SCHOOL,00414384,TERREBONNE PARISH SCHOOL DIST,40-75% (Mid-High),"$28K-31,999",,6,No,No,Houma,Terrebonne,LA,70363
02127654,220129001562,BALL ELEMENTARY SCHOOL,00410766,RAPIDES PARISH SCHOOL DISTRICT,40-75% (Mid-High),"$41K-42,999",,6,No,No,Ball,Rapides,LA,71405
00405826,220090000704,GALLIANO ELEMENTARY SCHOOL,00405747,LAFOURCHE PARISH SCHOOL DIST,40-75% (Mid-High),"$52K-54,999",,5,No,No,Galliano,Lafourche,LA,70354
12107464,220129002374,RAPIDES POSITIVE PGRM STUDENTS,00410766,RAPIDES PARISH SCHOOL DISTRICT,,"$32K-34,999",,12,No,No,Alexandria,Rapides,LA,71301
00400395,220033000279,WESTWOOD ELEMENTARY SCHOOL,00399722,CALCASIEU PARISH PUBLIC SCH,0-40% (Low),"$60K-64,999",,2,No,No,Westlake,Calcasieu,LA,70669
03007069,220084001881,GERALDINE BOUDREAUX ELEM SCH,00403713,JEFFERSON PARISH PUB SCH DIST,40-75% (Mid-High),"$55K-59,999",,5,No,Yes,Terrytown,Jefferson,LA,70056
10752269,220141002296,ANDREW JACKSON MIDDLE SCHOOL,00411978,ST BERNARD PARISH SCHOOL DIST,40-75% (Mid-High),"$45K-47,999",6,8,No,No,Chalmette,St Bernard,LA,70043
00401985,220054000428,SHERWOOD MS ACADEMIC MAG ACAD,00401064,EAST BATON ROUGE PARISH SD,40-75% (Mid-High),"$55K-59,999",6,8,No,Yes,Baton Rouge,East Baton Rouge,LA,70815
00400137,220033001677,PEARL WATSON ELEMENTARY SCHOOL,00399722,CALCASIEU PARISH PUBLIC SCH,40-75% (Mid-High),"$37K-38,999",,5,No,No,Lake Charles,Calcasieu,LA,70601
11915189,220018902349,SOUTHWEST LOUISIANA CHTR ACAD,11914678,CHARTER SCHOOLS USA,40-75% (Mid-High),"$45K-47,999",,8,Yes,No,Lake Charles,Calcasieu,LA,70607
00398522,220018000086,MERRYVILLE HIGH SCHOOL,00398443,BEAUREGARD PARISH SCHOOL DIST,40-75% (Mid-High),"$43K-44,999",,12,No,Yes,Merryville,Beauregard,LA,70653
01556234,220054000440,WEDGEWOOD ELEMENTARY SCHOOL,00401064,EAST BATON ROUGE PARISH SD,75%+ (High),"$60K-64,999",,5,No,Yes,Baton Rouge,East Baton Rouge,LA,70816
00406923,220114000830,GOLDONNA ELEM JR HIGH SCHOOL,00406820,NATCHITOCHES PARISH SCH DIST,40-75% (Mid-High),"$39K-40,999",,8,No,Yes,Goldonna,Natchitoches,LA,71031
10024531,220054002069,SCOTLANDVILLE MID PRE-ENG ACAD,00401064,EAST BATON ROUGE PARISH SD,75%+ (High),"$32K-34,999",6,8,No,Yes,Baton Rouge,East Baton Rouge,LA,70807
02897263,,LAKE FOREST ELEMENTARY CS,00407068,ORLEANS PARISH SCHOOL DISTRICT,,"$35K-36,999",,8,Yes,No,New Orleans,Orleans,LA,70128
00398974,220030000198,A C STEERE ELEMENTARY SCHOOL,00398962,CADDO PARISH PUBLIC SCHOOLS,0-40% (Low),"$48K-51,999",,5,No,Yes,Shreveport,Caddo,LA,71105
03010664,220168001900,HAMMOND WESTSIDE MONT SCHOOL,00413976,TANGIPAHOA PARISH SCHOOL DIST,40-75% (Mid-High),"$48K-51,999",,8,No,Yes,Hammond,Tangipahoa,LA,70403
00400838,220048000318,FERRIDAY JUNIOR HIGH SCHOOL,00400802,CONCORDIA PARISH SCHOOL DIST,75%+ (High),"$1–27,999",6,8,No,No,Ferriday,Concordia,LA,71334
02903393,220099000745,GLEN VIEW ELEMENTARY SCHOOL,00406181,LINCOLN PARISH SCHOOL DISTRICT,40-75% (Mid-High),"$35K-36,999",,2,No,No,Ruston,Lincoln,LA,71270
04946004,220018001507,EAST BEAUREGARD ELEM SCHOOL,00398443,BEAUREGARD PARISH SCHOOL DIST,40-75% (Mid-High),"$52K-54,999",,5,No,Yes,Deridder,Beauregard,LA,70634
00413964,220165001651,ST TAMMANY JUNIOR HIGH SCHOOL,00413639,ST TAMMANY PARISH SCH DISTRICT,40-75% (Mid-High),"$60K-64,999",6,8,No,No,Slidell,St Tammany,LA,70458
11560007,220024602079,KIPP CENTRAL CITY PRIMARY,11916250,KIPP NEW ORLEANS SCHOOLS,75%+ (High),"$1–27,999",,5,Yes,No,New Orleans,Orleans,LA,70113
02477875,,FIRST BAPTIST CHRISTIAN ACAD,,,,"$52K-54,999",,5,No,No,Deridder,Beauregard,LA,70634
00398479,220018000082,DERIDDER JUNIOR HIGH SCHOOL,00398443,BEAUREGARD PARISH SCHOOL DIST,40-75% (Mid-High),"$52K-54,999",6,8,No,No,Deridder,Beauregard,LA,70634
00415431,220186001426,PINE JR SR HIGH SCHOOL,00415352,WASHINGTON PARISH SCHOOL DIST,40-75% (Mid-High),"$39K-40,999",6,12,No,No,Franklinton,Washington,LA,70438
00400448,220036000283,UNION CENTRAL ELEMENTARY SCH,00400412,CALDWELL PARISH SCHOOL DIST,40-75% (Mid-High),"$32K-34,999",,5,No,Yes,Columbia,Caldwell,LA,71418
00402941,220066000486,FT NECESSITY JR HIGH SCHOOL,00402915,FRANKLIN PARISH SCHOOL DIST,40-75% (Mid-High),"$48K-51,999",,8,No,Yes,Ft Necessity,Franklin,LA,71243
00407496,,LUSHER CHARTER ELEMENTARY SCH,00407068,ORLEANS PARISH SCHOOL DISTRICT,,"$45K-47,999",,5,Yes,No,New Orleans,Orleans,LA,70118
11396222,,SS PETER AND PAUL CATHOLIC SCH,00405175,DIOCESE OF LAFAYETTE ED OFFICE,,"$41K-42,999",,8,No,No,Scott,Lafayette,LA,70583
12034726,220054002379,BROOKSTOWN MID MAGNET ACADEMY,00401064,EAST BATON ROUGE PARISH SD,40-75% (Mid-High),"$28K-31,999",6,8,No,Yes,Baton Rouge,East Baton Rouge,LA,70805
00413110,220156001213,SUNSET MIDDLE SCHOOL,00412702,ST LANDRY PARISH SCH DIST,40-75% (Mid-High),"$45K-47,999",5,8,No,No,Sunset,St Landry,LA,70584
00398015,220006000033,REEVES HIGH SCHOOL,00397920,ALLEN PARISH SCHOOL DISTRICT,40-75% (Mid-High),"$55K-59,999",,12,No,No,Reeves,Allen,LA,70658
01535113,220002301921,SOUTHERN UNIV LAB SCHOOL,00397671,LOUISIANA DEPT OF EDUCATION,75%+ (High),"$1–27,999",,12,Yes,No,Baton Rouge,East Baton Rouge,LA,70813
00398429,220015000077,RIVERSIDE ELEMENTARY SCHOOL,00398261,AVOYELLES PARISH SCHOOL DIST,40-75% (Mid-High),"$28K-31,999",,6,No,Yes,Simmesport,Avoyelles,LA,71369
02846692,220102001709,LEWIS VINCENT ELEM SCHOOL,00406325,LIVINGSTON PARISH PUB SCHOOLS,0-40% (Low),"$65K-69,999",,5,No,No,Denham Spgs,Livingston,LA,70726
11735161,220023302320,LOUISIANA VIRTUAL CHARTER ACAD,00397671,LOUISIANA DEPT OF EDUCATION,40-75% (Mid-High),"$43K-44,999",,12,Yes,No,Baton Rouge,East Baton Rouge,LA,70806
00403206,220072000511,DELCAMBRE HIGH SCHOOL,00403139,IBERIA PARISH SCHOOL DISTRICT,40-75% (Mid-High),"$48K-51,999",6,12,No,No,Delcambre,Vermilion,LA,70528
10914223,220020202041,SYLVANIE WILLIAMS CLG PREP ES,10029737,RECOVERY SCHOOL DISTRICT,,"$1–27,999",,,Yes,No,New Orleans,,LA,70113
12172445,220030002426,CADDO VIRTUAL ACADEMY,00398962,CADDO PARISH PUBLIC SCHOOLS,0-40% (Low),"$37K-38,999",9,12,No,No,Shreveport,Caddo,LA,71129
00408646,,TRINITY EPISCOPAL SCHOOL,,,,"$60K-64,999",,8,No,No,New Orleans,Orleans,LA,70130
00411253,220129001080,W O HALL SIXTH GRADE ACADEMY,00410766,RAPIDES PARISH SCHOOL DISTRICT,75%+ (High),"$28K-31,999",6,6,No,No,Alexandria,Rapides,LA,71302
02193445,,GETHSEMANE CHRISTIAN ACADEMY,,,,"$1–27,999",,8,No,No,Lafayette,Lafayette,LA,70501
02121090,,ASCENSION CHRISTIAN ELEM SCH,,,,"$70K-80,999",,6,No,No,Gonzales,Ascension,LA,70737
04925684,220003301485,INT'L SCH OF LOUISIANA-UPTOWN,00397671,LOUISIANA DEPT OF EDUCATION,75%+ (High),"$60K-64,999",,2,Yes,No,New Orleans,Orleans,LA,70130
00411007,220129001712,FOREST HILL JR HIGH SCHOOL,00410766,RAPIDES PARISH SCHOOL DISTRICT,75%+ (High),"$45K-47,999",,8,No,No,Forest Hill,Rapides,LA,71430
00412764,220156001215,WASHINGTON ELEMENTARY SCHOOL,00412702,ST LANDRY PARISH SCH DIST,75%+ (High),"$39K-40,999",,8,No,Yes,Washington,St Landry,LA,70589
00413079,220156001209,PORT BARRE ELEMENTARY SCHOOL,00412702,ST LANDRY PARISH SCH DIST,40-75% (Mid-High),"$35K-36,999",,4,No,Yes,Port Barre,St Landry,LA,70577
