MDR School ID,NCES ID,School Name,District Rollup ID,District Rollup Name,Demographics - Poverty Level,Demographics - Zipcode Median Income,Grades Covered - Low Grade,Grades Covered - High Grade,Is Charter (Yes / No),MDR School has School Account (Yes / No),School Address - City,School Address - County,School Address - State,School Address - Zipcode
00412738,220156001174,CANKTON ELEMENTARY SCHOOL,00412702,ST LANDRY PARISH SCH DIST,40-75% (Mid-High),"$45K-47,999",,4,No,Yes,Cankton,St Landry,LA,70584
00401442,220054000376,GLEN OAKS PARK ELEM SCHOOL,00401064,EAST BATON ROUGE PARISH SD,75%+ (High),"$43K-44,999",,5,No,Yes,Baton Rouge,East Baton Rouge,LA,70812
00404236,220084000629,LINCOLN ELEMENTARY SCHOOL ARTS,00403713,JEFFERSON PARISH PUB SCH DIST,75%+ (High),"$48K-51,999",,8,No,Yes,Marrero,Jefferson,LA,70072
01398484,220165001267,BONNE ECOLE ELEMENTARY SCHOOL,00413639,ST TAMMANY PARISH SCH DISTRICT,40-75% (Mid-High),"$60K-64,999",,6,No,Yes,Slidell,St Tammany,LA,70458
00401959,220054000425,SHARON HILLS ELEMENTARY SCHOOL,00401064,EAST BATON ROUGE PARISH SD,75%+ (High),"$48K-51,999",,5,No,Yes,Baton Rouge,East Baton Rouge,LA,70811
03012002,220027001870,STOCKWELL PLACE ELEMENTARY SCH,00398687,BOSSIER PARISH SCHOOL DIST,0-40% (Low),"$48K-51,999",,5,No,Yes,Bossier City,Bossier,LA,71111
00398821,220027000126,GREENACRES MIDDLE SCHOOL,00398687,BOSSIER PARISH SCHOOL DIST,40-75% (Mid-High),"$48K-51,999",6,8,No,Yes,Bossier City,Bossier,LA,71111
04286505,220165000384,CYPRESS COVE ELEMENTARY SCHOOL,00413639,ST TAMMANY PARISH SCH DISTRICT,40-75% (Mid-High),"$65K-69,999",,1,No,No,Slidell,St Tammany,LA,70461
00408127,220024302362,PAUL HABANS CHARTER SCHOOL,11930816,CRESCENT CITY SCHOOLS,40-75% (Mid-High),"$28K-31,999",,8,Yes,Yes,New Orleans,Orleans,LA,70114
00400046,220033000240,M J KAUFMAN ELEMENTARY SCHOOL,00399722,CALCASIEU PARISH PUBLIC SCH,40-75% (Mid-High),"$45K-47,999",,5,No,No,Lake Charles,Calcasieu,LA,70607
00400307,220033000269,VINTON ELEMENTARY SCHOOL,00399722,CALCASIEU PARISH PUBLIC SCH,40-75% (Mid-High),"$55K-59,999",,5,No,No,Vinton,Calcasieu,LA,70668
00415510,220189001440,CENTRAL ELEMENTARY SCHOOL,00415481,WEBSTER PARISH SCHOOL DIST,40-75% (Mid-High),"$28K-31,999",,5,No,Yes,Dubberly,Webster,LA,71024
00415508,220189001433,BROWNING ELEMENTARY SCHOOL,00415481,WEBSTER PARISH SCHOOL DIST,40-75% (Mid-High),"$28K-31,999",,2,No,Yes,Springhill,Webster,LA,71075
00401894,220054000421,RYAN ELEMENTARY SCHOOL,00401064,EAST BATON ROUGE PARISH SD,75%+ (High),"$32K-34,999",,5,No,Yes,Baton Rouge,East Baton Rouge,LA,70807
01171028,220174001355,LEGION PARK ELEMENTARY SCHOOL,00414384,TERREBONNE PARISH SCHOOL DIST,40-75% (Mid-High),"$45K-47,999",,6,No,No,Houma,Terrebonne,LA,70364
00412245,220144001144,LULING ELEMENTARY SCHOOL,00412154,ST CHARLES PARISH PUBLIC SD,75%+ (High),"$81K-93,999",,5,No,No,Luling,St Charles,LA,70070
00407915,220022000946,HARRIET TUBMAN CHARTER SCHOOL,11930816,CRESCENT CITY SCHOOLS,40-75% (Mid-High),"$28K-31,999",,8,Yes,No,New Orleans,Orleans,LA,70114
00403397,220072000532,PESSON ELEMENTARY SCHOOL,00403139,IBERIA PARISH SCHOOL DISTRICT,75%+ (High),"$35K-36,999",,6,No,No,New Iberia,Iberia,LA,70560
12369351,,MARTIAL BILLEAUD ELEM SCHOOL,00404755,LAFAYETTE PARISH SCH DISTRICT,,"$65K-69,999",,5,No,Yes,Broussard,Lafayette,LA,70518
00401272,220054000360,CAPITOL MIDDLE SCHOOL,00401064,EAST BATON ROUGE PARISH SD,75%+ (High),"$43K-44,999",6,8,No,Yes,Baton Rouge,East Baton Rouge,LA,70806
00402331,,MATER DOLOROSA SCHOOL,00402226,DIOCESE OF BATON ROUGE ED OFF,,"$39K-40,999",,8,No,No,Independence,Tangipahoa,LA,70443
11453193,220054002265,WOODLAWN ELEMENTARY SCHOOL,00401064,EAST BATON ROUGE PARISH SD,40-75% (Mid-High),$94K+,,5,No,Yes,Baton Rouge,East Baton Rouge,LA,70817
01170983,220174001350,GRAND CAILLOU ELEM SCHOOL,00414384,TERREBONNE PARISH SCHOOL DIST,40-75% (Mid-High),"$28K-31,999",,4,No,No,Houma,Terrebonne,LA,70363
00401595,220054000392,LASALLE ELEMENTARY SCHOOL,00401064,EAST BATON ROUGE PARISH SD,40-75% (Mid-High),"$43K-44,999",,5,No,Yes,Baton Rouge,East Baton Rouge,LA,70806
11222580,,FAMILY WORSHIP CHRN ACADEMY,,,,"$32K-34,999",,12,No,No,Opelousas,St Landry,LA,70570
04992039,,BRIGHTER HORIZON SCHOOL,,,,"$43K-44,999",,12,No,No,Baton Rouge,East Baton Rouge,LA,70806
01171107,220174001365,SCHRIEVER ELEMENTARY SCHOOL,00414384,TERREBONNE PARISH SCHOOL DIST,40-75% (Mid-High),"$41K-42,999",,3,No,No,Schriever,Terrebonne,LA,70395
00399708,,ST MARK'S CATHEDRAL SCHOOL,,,,"$35K-36,999",,8,No,No,Shreveport,Caddo,LA,71104
11452448,220021202278,ARISE ACADEMY,00407068,ORLEANS PARISH SCHOOL DISTRICT,75%+ (High),"$28K-31,999",,8,Yes,Yes,New Orleans,Orleans,LA,70117
00413354,220162001234,BAYOU VISTA ELEMENTARY SCHOOL,00413328,ST MARY PARISH SCHOOL DISTRICT,40-75% (Mid-High),"$39K-40,999",,5,No,Yes,Morgan City,St Mary,LA,70380
01171004,220174001352,HONDURAS ELEMENTARY SCHOOL,00414384,TERREBONNE PARISH SCHOOL DIST,40-75% (Mid-High),"$28K-31,999",,4,No,No,Houma,Terrebonne,LA,70363
00399124,220030000153,CHEROKEE PARK ELEM SCHOOL,00398962,CADDO PARISH PUBLIC SCHOOLS,75%+ (High),"$32K-34,999",,6,No,Yes,Shreveport,Caddo,LA,71107
00401193,220054000352,BERNARD TERRACE ELEM SCHOOL,00401064,EAST BATON ROUGE PARISH SD,75%+ (High),"$43K-44,999",,5,No,Yes,Baton Rouge,East Baton Rouge,LA,70806
00402953,220066000487,GILBERT SCHOOL,00402915,FRANKLIN PARISH SCHOOL DIST,40-75% (Mid-High),"$35K-36,999",,8,No,Yes,Gilbert,Franklin,LA,71336
00415754,220192001459,CANEVIEW K-8 SCHOOL,00415730,WEST BATON ROUGE PARISH SD,40-75% (Mid-High),"$60K-64,999",,8,No,Yes,Port Allen,West Baton Rouge,LA,70767
00410065,220108000788,CARROLL JUNIOR HIGH SCHOOL,00410027,MONROE CITY SCHOOL DISTRICT,75%+ (High),"$48K-51,999",7,8,No,No,Monroe,Ouachita,LA,71201
00401727,220003900406,NORTHWESTERN MIDDLE SCHOOL,05256917,ZACHARY COMMUNITY SCHOOL DIST,40-75% (Mid-High),"$70K-80,999",7,8,No,No,Zachary,East Baton Rouge,LA,70791
00407020,220114000841,PROVENCAL ELEM JUNIOR HIGH SCH,00406820,NATCHITOCHES PARISH SCH DIST,40-75% (Mid-High),"$45K-47,999",,8,No,Yes,Provencal,Natchitoches,LA,71468
00412257,220144001146,MIMOSA PARK ELEMENTARY SCHOOL,00412154,ST CHARLES PARISH PUBLIC SD,0-40% (Low),"$81K-93,999",,2,No,No,Luling,St Charles,LA,70070
00415493,220189001432,BROWN UPPER ELEMENTARY SCHOOL,00415481,WEBSTER PARISH SCHOOL DIST,40-75% (Mid-High),"$28K-31,999",3,5,No,Yes,Springhill,Webster,LA,71075
04880151,,ST BENEDICT THE MOOR SCHOOL,00408658,ARCHDIOCESE NEW ORLEANS ED OFF,,"$1–27,999",,4,No,No,New Orleans,Orleans,LA,70126
00411083,220129001063,NORTH BAYOU ELEMENTARY SCHOOL,00410766,RAPIDES PARISH SCHOOL DISTRICT,75%+ (High),"$48K-51,999",1,3,No,No,Alexandria,Rapides,LA,71303
00400436,220036000282,CALDWELL PARISH JR HIGH SCHOOL,00400412,CALDWELL PARISH SCHOOL DIST,40-75% (Mid-High),"$32K-34,999",6,8,No,No,Columbia,Caldwell,LA,71418
00398089,220009000040,GONZALES MIDDLE SCHOOL,00398027,ASCENSION PARISH SCHOOLS,40-75% (Mid-High),"$70K-80,999",6,8,No,No,Gonzales,Ascension,LA,70737
02846707,220102000754,ALBANY LOWER ELEMENTARY SCHOOL,00406325,LIVINGSTON PARISH PUB SCHOOLS,0-40% (Low),"$52K-54,999",,2,No,No,Albany,Livingston,LA,70711
00406961,220114001617,L P VAUGHN ELEMENTARY SCHOOL,00406820,NATCHITOCHES PARISH SCH DIST,40-75% (Mid-High),"$28K-31,999",,2,No,Yes,Natchitoches,Natchitoches,LA,71457
00415223,220183001418,WEST LEESVILLE ELEM SCHOOL,00415089,VERNON PARISH SCHOOL DISTRICT,40-75% (Mid-High),"$48K-51,999",2,4,No,Yes,Leesville,Vernon,LA,71446
01171119,220174001366,SOUTHDOWN ELEMENTARY SCHOOL,00414384,TERREBONNE PARISH SCHOOL DIST,40-75% (Mid-High),"$55K-59,999",,6,No,No,Houma,Terrebonne,LA,70360
00409262,,ST ALPHONSUS SCHOOL,00408658,ARCHDIOCESE NEW ORLEANS ED OFF,,"$60K-64,999",,7,No,No,New Orleans,Orleans,LA,70130
02105436,220033001506,RALPH WILSON ELEMENTARY SCHOOL,00399722,CALCASIEU PARISH PUBLIC SCH,75%+ (High),"$37K-38,999",3,5,No,No,Lake Charles,Calcasieu,LA,70601
00401739,220054000407,PARK ELEMENTARY SCHOOL,00401064,EAST BATON ROUGE PARISH SD,75%+ (High),"$28K-31,999",,5,No,Yes,Baton Rouge,East Baton Rouge,LA,70802
00407264,220117000907,EDWARD HYNES CS-LAKEVIEW,00407068,ORLEANS PARISH SCHOOL DISTRICT,0-40% (Low),"$81K-93,999",,8,Yes,No,New Orleans,Orleans,LA,70124
00415120,220183001408,HICKS HIGH SCHOOL,00415089,VERNON PARISH SCHOOL DISTRICT,40-75% (Mid-High),"$48K-51,999",,12,No,No,Leesville,Vernon,LA,71446
00415479,220186001431,WESLEY RAY ELEMENTARY SCHOOL,00415352,WASHINGTON PARISH SCHOOL DIST,40-75% (Mid-High),"$35K-36,999",,5,No,No,Angie,Washington,LA,70426
00400008,220033000241,JOHN F KENNEDY ELEMENTARY SCH,00399722,CALCASIEU PARISH PUBLIC SCH,40-75% (Mid-High),"$41K-42,999",,5,No,No,Lake Charles,Calcasieu,LA,70615
00405151,,ASCENSION EPISCOPAL-DOWNTOWN,,,,"$1–27,999",1,7,No,No,Lafayette,Lafayette,LA,70501
12365496,,IAPPS,00403414,IBERVILLE PARISH SCHOOL DIST,,"$52K-54,999",9,12,No,No,Plaquemine,Iberville,LA,70764
11552579,220102002313,JUBAN PARC ELEMENTARY SCHOOL,00406325,LIVINGSTON PARISH PUB SCHOOLS,0-40% (Low),"$65K-69,999",,5,No,No,Denham Spgs,Livingston,LA,70726
11557048,,RESURRECTION OF OUR LORD SCH,00408658,ARCHDIOCESE NEW ORLEANS ED OFF,,"$1–27,999",,8,No,No,New Orleans,Orleans,LA,70127
03243598,220117001938,BENJAMIN FRANKLIN ELEM SCHOOL,00407068,ORLEANS PARISH SCHOOL DISTRICT,40-75% (Mid-High),"$60K-64,999",,8,No,No,New Orleans,Orleans,LA,70115
00414097,220168001306,INDEPENDENCE LEADERSHIP ACAD,00413976,TANGIPAHOA PARISH SCHOOL DIST,40-75% (Mid-High),"$39K-40,999",,4,No,Yes,Independence,Tangipahoa,LA,70443
00403361,220072000529,NORTH STREET ELEMENTARY SCHOOL,00403139,IBERIA PARISH SCHOOL DISTRICT,40-75% (Mid-High),"$39K-40,999",,,No,No,New Iberia,Iberia,LA,70560
12044501,,BATON ROUGE UNIV PREP SCHOOL,00397671,LOUISIANA DEPT OF EDUCATION,,,,4,Yes,No,Baton Rouge,East Baton Rouge,LA,70874
11421229,,HOLY NAME OF JESUS SCHOOL,00408658,ARCHDIOCESE NEW ORLEANS ED OFF,,"$45K-47,999",,7,No,No,New Orleans,Orleans,LA,70118
00405840,220090000706,GOLDEN MEADOW MIDDLE SCHOOL,00405747,LAFOURCHE PARISH SCHOOL DIST,40-75% (Mid-High),"$52K-54,999",6,8,No,No,Golden Meadow,Lafourche,LA,70357
00406478,220102000768,MAUREPAS SCHOOL,00406325,LIVINGSTON PARISH PUB SCHOOLS,0-40% (Low),"$55K-59,999",,12,No,No,Maurepas,Livingston,LA,70449
01445714,,CALVARY BAPTIST ACADEMY,,,,"$48K-51,999",,12,No,No,Shreveport,Caddo,LA,71106
12225676,,LAKE CASTLE SLIDELL PVT SCH,,,,"$52K-54,999",,8,No,No,Slidell,St Tammany,LA,70460
12109486,220117002415,CYPRESS ACADEMY,00407068,ORLEANS PARISH SCHOOL DISTRICT,0-40% (Low),"$35K-36,999",,4,Yes,No,New Orleans,Orleans,LA,70119
00414645,220174001361,OAKLAWN JUNIOR HIGH SCHOOL,00414384,TERREBONNE PARISH SCHOOL DIST,40-75% (Mid-High),"$28K-31,999",7,8,No,No,Houma,Terrebonne,LA,70363
00407355,220117000856,MARY MCCLOUD BETHUNE CHTR ES,00407068,ORLEANS PARISH SCHOOL DISTRICT,40-75% (Mid-High),"$39K-40,999",,8,Yes,No,New Orleans,Orleans,LA,70122
01600603,,HOLY ROSARY ACADEMY & HIGH SCH,00408658,ARCHDIOCESE NEW ORLEANS ED OFF,,"$60K-64,999",,12,No,No,New Orleans,Orleans,LA,70115
12366127,,BULLION PRIMARY SCHOOL,00398027,ASCENSION PARISH SCHOOLS,,"$81K-93,999",,5,No,No,Prairieville,Ascension,LA,70769
01523079,220183000192,NORTH POLK ELEMENTARY SCHOOL,00415089,VERNON PARISH SCHOOL DISTRICT,40-75% (Mid-High),"$41K-42,999",,,No,No,Fort Polk,Vernon,LA,71459
00406428,220102000763,FRESHWATER ELEMENTARY SCHOOL,00406325,LIVINGSTON PARISH PUB SCHOOLS,0-40% (Low),"$65K-69,999",,5,No,No,Denham Spgs,Livingston,LA,70726
11717585,220018802340,NET CHARTER HIGH SCH-CTL CITY,00407068,ORLEANS PARISH SCHOOL DISTRICT,40-75% (Mid-High),"$1–27,999",9,12,Yes,No,New Orleans,Orleans,LA,70113
02113380,,ASCENSION CATHOLIC ELEM SCHOOL,00402226,DIOCESE OF BATON ROUGE ED OFF,,"$37K-38,999",,6,No,No,Donaldsonvlle,Ascension,LA,70346
04991994,,BETHEL CHRISTIAN SCHOOL,,,,"$37K-38,999",,12,No,No,Jennings,Jefferson Davis,LA,70546
01445879,,RUNNELS SCHOOL,,,,"$60K-64,999",,12,No,No,Baton Rouge,East Baton Rouge,LA,70816
02163177,,NORTHLAKE CHRISTIAN SCHOOL,,,,"$70K-80,999",,12,No,No,Covington,St Tammany,LA,70433
04456059,220009000462,CENTRAL MIDDLE SCHOOL,00398027,ASCENSION PARISH SCHOOLS,40-75% (Mid-High),"$70K-80,999",6,8,No,No,Gonzales,Ascension,LA,70737
11456042,220012000056,PIERRE PART MIDDLE SCHOOL,00398168,ASSUMPTION PARISH SCHOOL DIST,40-75% (Mid-High),"$65K-69,999",,,No,No,Pierre Part,Assumption,LA,70339
01867954,,LAFAYETTE CHRISTIAN ACADEMY,,,,"$43K-44,999",,12,No,No,Lafayette,Lafayette,LA,70507
02229874,,ST ELIZABETH ANN SETON SCHOOL,00408658,ARCHDIOCESE NEW ORLEANS ED OFF,,"$60K-64,999",,7,No,No,Kenner,Jefferson,LA,70065
00409341,,ST CHARLES BORROMEO ELEM SCH,00408658,ARCHDIOCESE NEW ORLEANS ED OFF,,"$81K-93,999",,7,No,No,Destrehan,St Charles,LA,70047
04867111,220051000626,MANSFIELD MIDDLE SCHOOL,00400943,DESOTO PARISH SCHOOL DISTRICT,40-75% (Mid-High),"$28K-31,999",5,8,No,No,Mansfield,De Soto,LA,71052
00397750,220003000007,CROWLEY MIDDLE SCHOOL,00397683,ACADIA PARISH SCHOOL DISTRICT,40-75% (Mid-High),"$32K-34,999",6,8,No,No,Crowley,Acadia,LA,70526
11449788,220165002255,LAKESHORE HIGH SCHOOL,00413639,ST TAMMANY PARISH SCH DISTRICT,0-40% (Low),"$81K-93,999",9,12,No,No,Mandeville,St Tammany,LA,70448
11815606,,ASCENSION CHRISTIAN HIGH SCH,,,,"$70K-80,999",7,12,No,No,Gonzales,Ascension,LA,70737
11548774,220102002315,SOUTH FORK ELEMENTARY SCHOOL,00406325,LIVINGSTON PARISH PUB SCHOOLS,0-40% (Low),"$65K-69,999",,5,No,No,Denham Spgs,Livingston,LA,70726
00398467,220018000081,DERIDDER HIGH SCHOOL,00398443,BEAUREGARD PARISH SCHOOL DIST,40-75% (Mid-High),"$52K-54,999",9,12,No,No,Deridder,Beauregard,LA,70634
00401454,220054000378,GLEN OAKS HIGH SCHOOL,00401064,EAST BATON ROUGE PARISH SD,75%+ (High),"$43K-44,999",9,12,No,Yes,Baton Rouge,East Baton Rouge,LA,70812
05119034,,RIVERDALE CHRISTIAN ACADEMY,,,,"$60K-64,999",,12,No,No,Baton Rouge,East Baton Rouge,LA,70816
00400022,220033000244,LAGRANGE SENIOR HIGH SCHOOL,00399722,CALCASIEU PARISH PUBLIC SCH,40-75% (Mid-High),"$45K-47,999",9,12,No,No,Lake Charles,Calcasieu,LA,70607
00409365,,ST CHRISTOPHER SCHOOL,00408658,ARCHDIOCESE NEW ORLEANS ED OFF,,"$52K-54,999",,8,No,No,Metairie,Jefferson,LA,70001
00415467,220186001429,VARNADO HIGH SCHOOL,00415352,WASHINGTON PARISH SCHOOL DIST,40-75% (Mid-High),"$35K-36,999",6,12,No,No,Angie,Washington,LA,70426
02163189,,NORTHSIDE CHRISTIAN SCHOOL,,,,"$32K-34,999",,12,No,No,Crowley,Acadia,LA,70526
01405960,,MONT SCH FOR SHREVEPORT,,,,"$35K-36,999",,8,No,No,Shreveport,Caddo,LA,71104
00414102,220168001307,INDEPENDENCE HIGH MAGNET SCH,00413976,TANGIPAHOA PARISH SCHOOL DIST,40-75% (Mid-High),"$39K-40,999",9,12,No,No,Independence,Tangipahoa,LA,70443
04427735,220102000403,SOUTH WALKER ELEMENTARY SCHOOL,00406325,LIVINGSTON PARISH PUB SCHOOLS,0-40% (Low),"$60K-64,999",,5,No,No,Walker,Livingston,LA,70785
02114308,,MOST BLESSED SACRAMENT SCHOOL,00402226,DIOCESE OF BATON ROUGE ED OFF,,$94K+,,8,No,No,Baton Rouge,East Baton Rouge,LA,70817
11727695,,NEW LIFE ACADEMY,,,,"$1–27,999",,10,No,No,Shreveport,Caddo,LA,71109
00398766,220027000120,BOSSIER HIGH SCHOOL,00398687,BOSSIER PARISH SCHOOL DIST,40-75% (Mid-High),"$48K-51,999",9,12,No,No,Bossier City,Bossier,LA,71111
04947888,220120001525,RICHWOOD HIGH SCHOOL,00410211,OUACHITA PARISH SCHOOL DIST,75%+ (High),"$1–27,999",9,12,No,No,Monroe,Ouachita,LA,71202
12044458,220030002382,PATHWAYS IN EDUC-SOUTHRN HILLS,00398962,CADDO PARISH PUBLIC SCHOOLS,40-75% (Mid-High),"$41K-42,999",9,12,Yes,No,Shreveport,Caddo,LA,71118
04886648,220004201634,MILESTONE ACADEMY,00397671,LOUISIANA DEPT OF EDUCATION,40-75% (Mid-High),"$41K-42,999",,,Yes,No,New Orleans,Orleans,LA,70122
00403933,220084000625,GRACE KING HIGH SCHOOL,00403713,JEFFERSON PARISH PUB SCH DIST,40-75% (Mid-High),"$60K-64,999",9,12,No,No,Metairie,Jefferson,LA,70002
04992089,,ALPINE CHRISTIAN SCHOOL,,,,"$48K-51,999",,8,No,No,Pineville,Rapides,LA,71360
12259237,,JCFA CHARTER SCH-LAFAYETTE,12259213,JCFA CHARTER SCHOOLS,,"$41K-42,999",9,12,Yes,No,Lafayette,Lafayette,LA,70506
00409391,,ST DOMINIC SCHOOL,00408658,ARCHDIOCESE NEW ORLEANS ED OFF,,"$81K-93,999",,7,No,No,New Orleans,Orleans,LA,70124
03047473,   ,GRAMBLING MIDDLE SCHOOL,00397671,LOUISIANA DEPT OF EDUCATION,,"$1–27,999",,,No,No,Grambling,,LA,71245
00411344,,LOYOLA COLLEGE PREP SCHOOL,02906084,DIOCESE OF SHREVEPORT ED OFF,,"$1–27,999",9,12,No,No,Shreveport,Caddo,LA,71101
01527568,220174001346,ELLENDER MEMORIAL HIGH SCHOOL,00414384,TERREBONNE PARISH SCHOOL DIST,40-75% (Mid-High),"$28K-31,999",9,12,No,No,Houma,Terrebonne,LA,70363
00397748,220003000006,CROWLEY HIGH SCHOOL,00397683,ACADIA PARISH SCHOOL DISTRICT,40-75% (Mid-High),"$32K-34,999",9,12,No,No,Crowley,Acadia,LA,70526
12235085,,ROOTED SCHOOL,00407068,ORLEANS PARISH SCHOOL DISTRICT,,"$60K-64,999",9,10,Yes,No,New Orleans,Orleans,LA,70115
00404705,220081000571,LAKE ARTHUR ELEMENTARY SCHOOL,00404597,JEFFERSON DAVIS PARISH SD,40-75% (Mid-High),"$45K-47,999",,6,No,No,Lake Arthur,Jefferson Davis,LA,70549
11552335,220027002310,ELM GROVE ELEMENTARY SCHOOL,00398687,BOSSIER PARISH SCHOOL DIST,40-75% (Mid-High),"$45K-47,999",,5,No,Yes,Elm Grove,Bossier,LA,71051
11440976,220024902367,MILDRED OSBORNE CHARTER SCHOOL,00407068,ORLEANS PARISH SCHOOL DISTRICT,40-75% (Mid-High),"$1–27,999",,8,Yes,Yes,New Orleans,Orleans,LA,70126
02127197,220108000996,MADISON JAMES FOSTER ELEM SCH,00410027,MONROE CITY SCHOOL DISTRICT,75%+ (High),"$1–27,999",,6,No,Yes,Monroe,Ouachita,LA,71202
11734959,220015802319,LAKE CHARLES CHARTER ACADEMY,11914678,CHARTER SCHOOLS USA,75%+ (High),"$45K-47,999",,8,Yes,Yes,Lake Charles,Calcasieu,LA,70607
00401765,220004000410,PARK RIDGE ACADEMIC MAGNET SCH,05256905,CITY OF BAKER SCHOOL SYSTEM,40-75% (Mid-High),"$55K-59,999",,8,No,No,Baker,East Baton Rouge,LA,70714
04375675,220153000430,GARYVILLE-MT AIRY MAGNET SCH,00412556,ST JOHN THE BAPTIST PARISH SD,40-75% (Mid-High),"$55K-59,999",,8,No,No,Mount Airy,St John The Baptist,LA,70076
00406210,220099000743,CYPRESS SPRINGS ELEM SCHOOL,00406181,LINCOLN PARISH SCHOOL DISTRICT,40-75% (Mid-High),"$35K-36,999",3,5,No,Yes,Ruston,Lincoln,LA,71270
00404925,220087000670,KATHARINE DREXEL ELEM SCHOOL,00404755,LAFAYETTE PARISH SCH DISTRICT,40-75% (Mid-High),"$65K-69,999",,4,No,Yes,Broussard,Lafayette,LA,70518
00401088,220054000341,AUDUBON ELEMENTARY SCHOOL,00401064,EAST BATON ROUGE PARISH SD,75%+ (High),"$55K-59,999",,5,No,Yes,Baton Rouge,East Baton Rouge,LA,70815
00406947,220114000845,M R WEAVER ELEMENTARY SCHOOL,00406820,NATCHITOCHES PARISH SCH DIST,75%+ (High),"$28K-31,999",3,4,No,Yes,Natchitoches,Natchitoches,LA,71457
04286517,220165010400,PONTCHARTRAIN ELEM SCHOOL,00413639,ST TAMMANY PARISH SCH DISTRICT,0-40% (Low),"$81K-93,999",,3,No,Yes,Mandeville,St Tammany,LA,70471
03246291,220072001925,DASPIT ELEMENTARY SCHOOL,00403139,IBERIA PARISH SCHOOL DISTRICT,40-75% (Mid-High),"$48K-51,999",,6,No,No,New Iberia,Iberia,LA,70563
00401961,220054000426,SHENANDOAH ELEMENTARY SCHOOL,00401064,EAST BATON ROUGE PARISH SD,40-75% (Mid-High),$94K+,,5,No,Yes,Baton Rouge,East Baton Rouge,LA,70817
00403220,220072002260,CANEVIEW ELEMENTARY SCHOOL,00403139,IBERIA PARISH SCHOOL DISTRICT,40-75% (Mid-High),"$35K-36,999",,6,No,No,New Iberia,Iberia,LA,70560
11926425,220084000653,KENNER DISCOVERY HLTH SCI ACAD,00403713,JEFFERSON PARISH PUB SCH DIST,0-40% (Low),"$52K-54,999",,,Yes,Yes,Metairie,,LA,70003
12239469,,ISTROUMA HIGH SCHOOL,00401064,EAST BATON ROUGE PARISH SD,,"$28K-31,999",6,12,No,Yes,Baton Rouge,East Baton Rouge,LA,70805
00410302,220120000992,HIGHLAND ELEMENTARY SCHOOL,00410211,OUACHITA PARISH SCHOOL DIST,0-40% (Low),"$48K-51,999",,5,No,No,West Monroe,Ouachita,LA,71291
01447231,,TENSAS ACADEMY,,,,"$1–27,999",,12,No,No,Saint Joseph,Tensas,LA,71366
12259134,220030002431,AMIKIDS CADDO,00398962,CADDO PARISH PUBLIC SCHOOLS,40-75% (Mid-High),"$1–27,999",6,8,Yes,No,Shreveport,Caddo,LA,71109
12161044,220025402408,DEMOCRACY PREP BATON ROUGE,11912498,DEMOCRACY PREP PUBLIC SCHOOLS,40-75% (Mid-High),"$28K-31,999",,8,Yes,Yes,Baton Rouge,East Baton Rouge,LA,70805
02892251,220165001716,BAYOU WOODS ELEMENTARY SCHOOL,00413639,ST TAMMANY PARISH SCH DISTRICT,75%+ (High),"$52K-54,999",,3,No,Yes,Slidell,St Tammany,LA,70460
00412427,220150001160,ST LOUIS ACADEMY,00412415,ST JAMES PARISH SCHOOL DIST,40-75% (Mid-High),"$32K-34,999",,3,No,No,Saint James,St James,LA,70086
00405199,,CARENCRO CATHOLIC SCHOOL,00405175,DIOCESE OF LAFAYETTE ED OFFICE,,"$52K-54,999",,8,No,No,Carencro,Lafayette,LA,70520
10754566,,42 CHARTER SCHOOL,12179039,INSPIRENOLA CHARTER SCHOOLS,,"$35K-36,999",,8,Yes,Yes,New Orleans,Orleans,LA,70119
05099006,220009001540,DUPLESSIS PRIMARY SCHOOL,00398027,ASCENSION PARISH SCHOOLS,0-40% (Low),"$70K-80,999",,5,No,No,Gonzales,Ascension,LA,70737
00413598,220162001259,H A WATTS ELEMENTARY SCHOOL,00413328,ST MARY PARISH SCHOOL DISTRICT,40-75% (Mid-High),"$45K-47,999",,4,No,Yes,Patterson,St Mary,LA,70392
00401571,220054000390,LA BELLE AIRE ELEM SCHOOL,00401064,EAST BATON ROUGE PARISH SD,75%+ (High),"$55K-59,999",,5,No,Yes,Baton Rouge,East Baton Rouge,LA,70815
00399033,220030000145,BLANCHARD ELEMENTARY SCHOOL,00398962,CADDO PARISH PUBLIC SCHOOLS,40-75% (Mid-High),"$32K-34,999",,4,No,Yes,Shreveport,Caddo,LA,71107
00399150,220030000157,EDEN GARDENS MAGNET ELEMENTARY,00398962,CADDO PARISH PUBLIC SCHOOLS,0-40% (Low),"$48K-51,999",,5,No,Yes,Shreveport,Caddo,LA,71106
00404028,220084000613,HARAHAN ELEMENTARY SCHOOL,00403713,JEFFERSON PARISH PUB SCH DIST,0-40% (Low),"$65K-69,999",,5,No,Yes,Harahan,Jefferson,LA,70123
03248964,220120001940,GEORGE WELCH ELEMENTARY SCHOOL,00410211,OUACHITA PARISH SCHOOL DIST,0-40% (Low),"$48K-51,999",,5,No,No,West Monroe,Ouachita,LA,71291
11180542,220141001131,DAVIES ELEMENTARY SCHOOL,00411978,ST BERNARD PARISH SCHOOL DIST,40-75% (Mid-High),"$70K-80,999",,5,No,Yes,Meraux,St Bernard,LA,70075
02897287,,ROBERT R MOTON CHARTER ES,00407068,ORLEANS PARISH SCHOOL DISTRICT,,"$1–27,999",,8,Yes,No,New Orleans,Orleans,LA,70127
00401521,220054000385,HOWELL PARK ELEMENTARY SCHOOL,00401064,EAST BATON ROUGE PARISH SD,75%+ (High),"$28K-31,999",,5,No,Yes,Baton Rouge,East Baton Rouge,LA,70805
00397932,220006000024,ELIZABETH HIGH SCHOOL,00397920,ALLEN PARISH SCHOOL DISTRICT,40-75% (Mid-High),,,12,No,No,Elizabeth,Allen,LA,70638
11448136,,MATH SCI & ARTS ACADEMY-EAST,00403414,IBERVILLE PARISH SCHOOL DIST,,"$70K-80,999",,12,No,Yes,Saint Gabriel,Iberville,LA,70776
00403749,220084000599,ALLEN ELLENDER SCHOOL,00403713,JEFFERSON PARISH PUB SCH DIST,40-75% (Mid-High),"$48K-51,999",,8,No,Yes,Marrero,Jefferson,LA,70072
11931224,220023402375,TALLULAH CHARTER SCHOOL,00397671,LOUISIANA DEPT OF EDUCATION,75%+ (High),"$32K-34,999",,10,Yes,No,Tallulah,Madison,LA,71282
00400840,220048000319,FERRIDAY LOWER ELEMENTARY SCH,00400802,CONCORDIA PARISH SCHOOL DIST,40-75% (Mid-High),"$1–27,999",,2,No,Yes,Ferriday,Concordia,LA,71334
12375245,,GEO NEXT GENERATION HIGH SCH,11913246,GEO FOUNDATION,,"$55K-59,999",9,9,Yes,No,Baton Rouge,East Baton Rouge,LA,70815
00406480,220102000769,NORTHSIDE ELEMENTARY SCHOOL,00406325,LIVINGSTON PARISH PUB SCHOOLS,0-40% (Low),"$65K-69,999",,5,No,No,Denham Spgs,Livingston,LA,70726
00399239,220030000165,HERNDON MAGNET SCHOOL,00398962,CADDO PARISH PUBLIC SCHOOLS,0-40% (Low),"$39K-40,999",,8,No,Yes,Belcher,Caddo,LA,71004
11455115,220153002281,EMILY C WATKINS ELEM SCHOOL,00412556,ST JOHN THE BAPTIST PARISH SD,40-75% (Mid-High),"$60K-64,999",,8,No,No,La Place,St John The Baptist,LA,70068
00403141,220072000505,ANDERSON MIDDLE SCHOOL,00403139,IBERIA PARISH SCHOOL DISTRICT,75%+ (High),"$35K-36,999",7,8,No,No,New Iberia,Iberia,LA,70560
11828988,220084002346,INT'L SCH OF LOUISIANA-DIXON,00397671,LOUISIANA DEPT OF EDUCATION,,"$45K-47,999",,2,Yes,Yes,New Orleans,Orleans,LA,70118
00404420,220084000630,LIVAUDAIS MIDDLE SCHOOL,00403713,JEFFERSON PARISH PUB SCH DIST,40-75% (Mid-High),"$55K-59,999",6,8,No,Yes,Terrytown,Jefferson,LA,70056
00399904,220033000280,F K WHITE MIDDLE SCHOOL,00399722,CALCASIEU PARISH PUBLIC SCH,0-40% (Low),"$45K-47,999",6,8,No,No,Lake Charles,Calcasieu,LA,70607
11825338,220129002344,CAROLINE DORMON JUNIOR HS,00410766,RAPIDES PARISH SCHOOL DISTRICT,0-40% (Low),"$55K-59,999",,8,No,No,Woodworth,Rapides,LA,71485
00403127,220069000504,VERDA ELEMENTARY SCHOOL,00403050,GRANT PARISH SCHOOL DISTRICT,40-75% (Mid-High),"$37K-38,999",,6,No,Yes,Montgomery,Grant,LA,71454
00415649,220189001445,J A PHILLIPS MIDDLE SCHOOL,00415481,WEBSTER PARISH SCHOOL DIST,75%+ (High),"$35K-36,999",,,No,No,Minden,,LA,71055
11930828,,JCFA CHARTER SCH-EAST,12259213,JCFA CHARTER SCHOOLS,,"$52K-54,999",8,12,Yes,No,Jefferson,Jefferson,LA,70121
11715501,220165002329,LANCASTER ELEMENTARY SCHOOL,00413639,ST TAMMANY PARISH SCH DISTRICT,0-40% (Low),$94K+,3,6,No,No,Madisonville,St Tammany,LA,70447
00399899,220033000261,COMBRE FONDEL ELEMENTARY SCH,00399722,CALCASIEU PARISH PUBLIC SCH,75%+ (High),"$37K-38,999",3,5,No,No,Lake Charles,Calcasieu,LA,70601
10914065,220024402043,KIPP CENTRAL CITY ACADEMY,11916250,KIPP NEW ORLEANS SCHOOLS,,"$1–27,999",6,8,Yes,No,New Orleans,Orleans,LA,70113
00400242,220033000264,ST JOHN ELEMENTARY SCHOOL,00399722,CALCASIEU PARISH PUBLIC SCH,40-75% (Mid-High),"$70K-80,999",,5,No,No,Lake Charles,Calcasieu,LA,70605
00404963,220087000678,LAFAYETTE HIGH SCHOOL,00404755,LAFAYETTE PARISH SCH DISTRICT,40-75% (Mid-High),"$41K-42,999",9,12,No,No,Lafayette,Lafayette,LA,70506
00411239,220129001083,ALMA REDWINE ELEMENTARY SCHOOL,00410766,RAPIDES PARISH SCHOOL DISTRICT,75%+ (High),"$32K-34,999",4,5,No,No,Alexandria,Rapides,LA,71301
01171042,220174001358,MONTEGUT ELEMENTARY SCHOOL,00414384,TERREBONNE PARISH SCHOOL DIST,40-75% (Mid-High),"$35K-36,999",,4,No,No,Montegut,Terrebonne,LA,70377
01171145,220174001370,UPPER LITTLE CAILLOU ELEM SCH,00414384,TERREBONNE PARISH SCHOOL DIST,40-75% (Mid-High),"$32K-34,999",,4,No,No,Chauvin,Terrebonne,LA,70344
00402800,220063000473,CHATAIGNER ELEMENTARY SCHOOL,00402769,EVANGELINE PARISH SCHOOL DIST,40-75% (Mid-High),,,8,No,Yes,Chataignier,Evangeline,LA,70524
03325213,220009000037,DUTCHTOWN MIDDLE SCHOOL,00398027,ASCENSION PARISH SCHOOLS,0-40% (Low),"$81K-93,999",6,8,No,No,Geismar,Ascension,LA,70734
