11453301,220168002274,JEWEL M SUMNER MIDDLE SCHOOL,00413976,TANGIPAHOA PARISH SCHOOL DIST,40-75% (Mid-High),"$32K-34,999",6,8,No,No,Kentwood,Tangipahoa,LA,70444
00405814,220090000703,EAST THIBODAUX MIDDLE SCHOOL,00405747,LAFOURCHE PARISH SCHOOL DIST,75%+ (High),"$48K-51,999",6,8,No,No,Thibodaux,Lafourche,LA,70301
11128465,220020802071,AKILI ACADEMY OF NEW ORLEANS,11930816,CRESCENT CITY SCHOOLS,40-75% (Mid-High),"$28K-31,999",,8,Yes,Yes,New Orleans,Orleans,LA,70117
00412893,220156001190,LAWTELL ELEMENTARY SCHOOL,00412702,ST LANDRY PARISH SCH DIST,40-75% (Mid-High),,,8,No,Yes,Lawtell,St Landry,LA,70550
00412843,220156001183,GLENDALE ELEMENTARY SCHOOL,00412702,ST LANDRY PARISH SCH DIST,40-75% (Mid-High),"$39K-40,999",,4,No,Yes,Eunice,St Landry,LA,70535
00413031,220156001206,PARK VISTA ELEMENTARY SCHOOL,00412702,ST LANDRY PARISH SCH DIST,40-75% (Mid-High),,,6,No,Yes,Opelousas,St Landry,LA,70571
00405759,220090000697,BAYOU BLUE ELEMENTARY SCHOOL,00405747,LAFOURCHE PARISH SCHOOL DIST,75%+ (High),"$45K-47,999",,2,No,No,Houma,Terrebonne,LA,70364
10024529,220054001692,WOODLAWN MIDDLE SCHOOL,00401064,EAST BATON ROUGE PARISH SD,40-75% (Mid-High),$94K+,6,8,No,Yes,Baton Rouge,East Baton Rouge,LA,70817
00400254,220033000265,STARKS HIGH SCHOOL,00399722,CALCASIEU PARISH PUBLIC SCH,0-40% (Low),"$55K-59,999",,12,No,Yes,Starks,Calcasieu,LA,70661
00406296,220099000751,RUSTON ELEMENTARY SCHOOL,00406181,LINCOLN PARISH SCHOOL DISTRICT,0-40% (Low),"$35K-36,999",3,5,No,Yes,Ruston,Lincoln,LA,71270
00398950,220027000139,WALLER ELEMENTARY SCHOOL,00398687,BOSSIER PARISH SCHOOL DIST,40-75% (Mid-High),"$48K-51,999",,5,No,Yes,Bossier City,Bossier,LA,71112
00398900,220027000135,HAUGHTON MIDDLE SCHOOL,00398687,BOSSIER PARISH SCHOOL DIST,0-40% (Low),"$48K-51,999",6,8,No,Yes,Haughton,Bossier,LA,71037
00398716,220027000114,BELLAIRE ELEMENTARY SCHOOL,00398687,BOSSIER PARISH SCHOOL DIST,0-40% (Low),"$48K-51,999",,3,No,Yes,Bossier City,Bossier,LA,71112
11450282,220009002262,LAKESIDE PRIMARY SCHOOL,00398027,ASCENSION PARISH SCHOOLS,0-40% (Low),"$81K-93,999",,5,No,No,Prairieville,Ascension,LA,70769
00402094,220054000442,WESTDALE MIDDLE SCHOOL,00401064,EAST BATON ROUGE PARISH SD,40-75% (Mid-High),"$43K-44,999",6,8,No,Yes,Baton Rouge,East Baton Rouge,LA,70806
11715458,220009002326,SORRENTO PRIMARY SCHOOL,00398027,ASCENSION PARISH SCHOOLS,40-75% (Mid-High),"$65K-69,999",,5,No,No,Sorrento,Ascension,LA,70778
00399411,220030000181,NORTHSIDE ELEMENTARY SCHOOL,00398962,CADDO PARISH PUBLIC SCHOOLS,75%+ (High),"$32K-34,999",,6,No,Yes,Shreveport,Caddo,LA,71107
00406272,220099000747,HILLCREST ELEMENTARY SCHOOL,00406181,LINCOLN PARISH SCHOOL DISTRICT,40-75% (Mid-High),"$35K-36,999",,2,No,No,Ruston,Lincoln,LA,71270
00403995,220084001965,GRETNA ACADEMY 2,00403713,JEFFERSON PARISH PUB SCH DIST,0-40% (Low),"$41K-42,999",,5,No,Yes,Gretna,Jefferson,LA,70053
00415065,220180001387,DOZIER ELEMENTARY SCHOOL,00414891,VERMILION PARISH SCHOOL DIST,0-40% (Low),"$48K-51,999",,5,No,Yes,Erath,Vermilion,LA,70533
00404999,220087000685,MYRTLE PLACE ELEMENTARY SCHOOL,00404755,LAFAYETTE PARISH SCH DISTRICT,0-40% (Low),"$41K-42,999",,5,No,Yes,Lafayette,Lafayette,LA,70506
03008427,220165001897,RIVERSIDE ELEMENTARY SCHOOL,00413639,ST TAMMANY PARISH SCH DISTRICT,40-75% (Mid-High),"$48K-51,999",1,5,No,Yes,Pearl River,St Tammany,LA,70452
00398352,220015000069,LAFARGUE ELEMENTARY SCHOOL,00398261,AVOYELLES PARISH SCHOOL DIST,40-75% (Mid-High),"$48K-51,999",,6,No,Yes,Effie,Avoyelles,LA,71331
00401208,220054000353,BROADMOOR ELEMENTARY SCHOOL,00401064,EAST BATON ROUGE PARISH SD,40-75% (Mid-High),"$55K-59,999",,5,No,Yes,Baton Rouge,East Baton Rouge,LA,70815
00405034,220087000663,PAUL BREAUX MIDDLE SCHOOL,00404755,LAFAYETTE PARISH SCH DISTRICT,40-75% (Mid-High),"$1–27,999",6,8,No,Yes,Lafayette,Lafayette,LA,70501
00410338,220120000994,LAKESHORE ELEMENTARY SCHOOL,00410211,OUACHITA PARISH SCHOOL DIST,40-75% (Mid-High),"$45K-47,999",,5,No,No,Monroe,Ouachita,LA,71203
00407927,,ALICE M HARTE CHARTER SCHOOL,12179039,INSPIRENOLA CHARTER SCHOOLS,,"$48K-51,999",,8,Yes,Yes,New Orleans,Orleans,LA,70131
00401650,220054000399,MERRYDALE ELEMENTARY SCHOOL,00401064,EAST BATON ROUGE PARISH SD,75%+ (High),"$43K-44,999",,5,No,Yes,Baton Rouge,East Baton Rouge,LA,70812
00412647,220153002003,FIFTH WARD ELEMENTARY SCHOOL,00412556,ST JOHN THE BAPTIST PARISH SD,75%+ (High),"$48K-51,999",,4,No,Yes,Reserve,St John The Baptist,LA,70084
00405761,220090000698,BAYOU BOEUF ELEMENTARY SCHOOL,00405747,LAFOURCHE PARISH SCHOOL DIST,40-75% (Mid-High),"$48K-51,999",,5,No,No,Thibodaux,Lafourche,LA,70301
00410716,220126002001,ROUGON ELEMENTARY SCHOOL,00410651,POINTE COUPEE PARISH SCH DIST,40-75% (Mid-High),"$52K-54,999",,8,No,No,Rougon,Pointe Coupee,LA,70773
00404377,220084000602,ESTELLE ELEMENTARY SCHOOL,00403713,JEFFERSON PARISH PUB SCH DIST,40-75% (Mid-High),"$48K-51,999",,8,No,Yes,Marrero,Jefferson,LA,70072
00400515,220039000289,GRAND LAKE HIGH SCHOOL,00400486,CAMERON PARISH SCHOOL DISTRICT,0-40% (Low),"$45K-47,999",,12,No,No,Lake Charles,Calcasieu,LA,70607
00408452,220020900949,MEDARD H NELSON CHARTER SCHOOL,00407068,ORLEANS PARISH SCHOOL DISTRICT,75%+ (High),"$35K-36,999",,,Yes,No,New Orleans,Orleans,LA,70119
00403189,220072000509,CENTER ST ELEMENTARY SCHOOL,00403139,IBERIA PARISH SCHOOL DISTRICT,40-75% (Mid-High),"$35K-36,999",,6,No,No,New Iberia,Iberia,LA,70560
00415807,220192001464,PORT ALLEN HIGH SCHOOL,00415730,WEST BATON ROUGE PARISH SD,75%+ (High),"$60K-64,999",9,12,No,No,Port Allen,West Baton Rouge,LA,70767
12235114,,EINSTEIN CHTR HIGH SCH-REED,12110411,THE EINSTEIN GROUP INC,,"$37K-38,999",9,11,Yes,No,New Orleans,Orleans,LA,70129
00408816,,DE LASALLE HIGH SCHOOL,00408658,ARCHDIOCESE NEW ORLEANS ED OFF,,"$60K-64,999",8,12,No,No,New Orleans,Orleans,LA,70115
00403103,220069000502,MONTGOMERY HIGH SCHOOL,00403050,GRANT PARISH SCHOOL DISTRICT,40-75% (Mid-High),"$37K-38,999",7,12,No,No,Montgomery,Grant,LA,71454
01483297,,ST FRANCIS XAVIER SCHOOL,00402226,DIOCESE OF BATON ROUGE ED OFF,,"$28K-31,999",,8,No,No,Baton Rouge,East Baton Rouge,LA,70802
01446940,,RIVERFIELD ACADEMY,,,,"$37K-38,999",,12,No,No,Rayville,Richland,LA,71269
00406868,220114000101,LAKEVIEW JR SR HIGH SCHOOL,00406820,NATCHITOCHES PARISH SCH DIST,40-75% (Mid-High),"$28K-31,999",7,12,No,No,Campti,Natchitoches,LA,71411
00402197,,EPISCOPAL SCH OF BATON ROUGE,,,,"$60K-64,999",,12,No,No,Baton Rouge,East Baton Rouge,LA,70816
12235035,220027702434,KIPP BOOKER T WASHINGTON HS,11916250,KIPP NEW ORLEANS SCHOOLS,40-75% (Mid-High),"$39K-40,999",9,11,Yes,No,New Orleans,Orleans,LA,70125
01446835,,FALSE RIVER ACADEMY,,,,"$43K-44,999",,12,No,No,New Roads,Pointe Coupee,LA,70760
12225729,,LIVINGWORD ACADEMY,,,,"$28K-31,999",,5,No,No,Shreveport,Caddo,LA,71108
00411538,,ST JOSEPH SCHOOL,00411289,DIOCESE OF ALEXANDRIA ED OFF,,"$45K-47,999",,12,No,No,Plaucheville,Avoyelles,LA,71362
04435859,,PLAQUEMINES PARISH LRNG CTR,00410572,PLAQUEMINES PARISH SCH DIST,,"$32K-34,999",6,12,No,No,Port Sulphur,Plaquemines,LA,70083
00397982,220006000029,OAKDALE HIGH SCHOOL,00397920,ALLEN PARISH SCHOOL DISTRICT,40-75% (Mid-High),"$37K-38,999",9,12,No,No,Oakdale,Allen,LA,71463
11452656,,DOUGLAS ACAD FOR CAREER PREP,00403713,JEFFERSON PARISH PUB SCH DIST,0-40% (Low),,,,No,No,Marrero,,LA,70072
00406234,220099001815,RUSTON JUNIOR HIGH SCHOOL,00406181,LINCOLN PARISH SCHOOL DISTRICT,0-40% (Low),"$35K-36,999",7,8,No,No,Ruston,Lincoln,LA,71270
00409377,,ST CLEMENT OF ROME SCHOOL,00408658,ARCHDIOCESE NEW ORLEANS ED OFF,,"$60K-64,999",,7,No,No,Metairie,Jefferson,LA,70002
00401117,220004000343,BAKER MIDDLE SCHOOL,05256905,CITY OF BAKER SCHOOL SYSTEM,40-75% (Mid-High),"$55K-59,999",6,8,No,No,Baker,East Baton Rouge,LA,70714
00405606,,ST IGNATIUS SCHOOL,00405175,DIOCESE OF LAFAYETTE ED OFFICE,,,,8,No,No,Grand Coteau,St Landry,LA,70541
00415687,220189001451,NORTH WEBSTER HIGH SCHOOL,00415481,WEBSTER PARISH SCHOOL DIST,0-40% (Low),"$28K-31,999",9,12,No,No,Springhill,Webster,LA,71075
00413421,220162001243,FRANKLIN JUNIOR HIGH SCHOOL,00413328,ST MARY PARISH SCHOOL DISTRICT,40-75% (Mid-High),"$41K-42,999",6,8,No,No,Franklin,St Mary,LA,70538
02085238,,HAMILTON CHRISTIAN SCHOOL,,,,"$37K-38,999",,12,No,No,Lake Charles,Calcasieu,LA,70601
04452857,220108002019,SHERROUSE SCHOOL,00410027,MONROE CITY SCHOOL DISTRICT,75%+ (High),"$45K-47,999",,12,No,No,Monroe,Ouachita,LA,71203
12314746,,ROSENWALD COLLEGIATE,12115203,COLLEGIATE ACADEMIES,,"$28K-31,999",9,10,Yes,No,New Orleans,Orleans,LA,70114
00399978,220033000238,IOWA HIGH SCHOOL,00399722,CALCASIEU PARISH PUBLIC SCH,40-75% (Mid-High),"$55K-59,999",6,12,No,No,Iowa,Calcasieu,LA,70647
11712444,220120002325,STERLINGTON MIDDLE SCHOOL,00410211,OUACHITA PARISH SCHOOL DIST,0-40% (Low),"$55K-59,999",6,8,No,No,Sterlington,Ouachita,LA,71280
00405890,220090000712,LOCKPORT MIDDLE SCHOOL,00405747,LAFOURCHE PARISH SCHOOL DIST,40-75% (Mid-High),"$60K-64,999",6,8,No,No,Lockport,Lafourche,LA,70374
00408787,,CHRIST THE KING SCHOOL,00408658,ARCHDIOCESE NEW ORLEANS ED OFF,,"$55K-59,999",,8,No,No,Terrytown,Jefferson,LA,70056
11662966,220054002311,MENTORSHIP STEAM ACADEMY,00401064,EAST BATON ROUGE PARISH SD,75%+ (High),"$1–27,999",9,12,Yes,No,Baton Rouge,East Baton Rouge,LA,70801
00409559,,ST JOSEPH CATHOLIC ELEM SCHOOL,01600641,DIOCESE HOUMA-THIBODAUX ED OFF,,"$48K-51,999",,7,No,No,Thibodaux,Lafourche,LA,70301
00412104,220141001136,N P TRIST MIDDLE SCHOOL,00411978,ST BERNARD PARISH SCHOOL DIST,40-75% (Mid-High),"$70K-80,999",6,8,No,No,Meraux,St Bernard,LA,70075
00413043,220156002007,PLAISANCE MIDDLE SCHOOL,00412702,ST LANDRY PARISH SCH DIST,40-75% (Mid-High),"$32K-34,999",5,8,No,No,Opelousas,St Landry,LA,70570
00409078,,OUR LADY OF LOURDES SCHOOL,00408658,ARCHDIOCESE NEW ORLEANS ED OFF,,"$60K-64,999",,8,No,No,Slidell,St Tammany,LA,70458
01868037,,HOPE BAPTIST SCHOOL,,,,"$48K-51,999",,12,No,No,Alexandria,Rapides,LA,71303
00402240,,ASCENSION CATH DIO REG SCH,00402226,DIOCESE OF BATON ROUGE ED OFF,,"$37K-38,999",,12,No,No,Donaldsonvlle,Ascension,LA,70346
00406167,220096000738,LASALLE JUNIOR HIGH SCHOOL,00406064,LASALLE PARISH SCHOOL DIST,40-75% (Mid-High),,6,8,No,No,Urania,La Salle,LA,71480
00411784,220135001099,MANGHAM ELEMENTARY SCHOOL,00411710,RICHLAND PARISH SCHOOL DIST,40-75% (Mid-High),"$41K-42,999",,5,No,No,Mangham,Richland,LA,71259
00413809,220165001280,FOLSOM JUNIOR HIGH SCHOOL,00413639,ST TAMMANY PARISH SCH DISTRICT,40-75% (Mid-High),"$70K-80,999",6,8,No,No,Folsom,St Tammany,LA,70437
01808685,220084000656,WOODLAND WEST ELEM SCHOOL,00403713,JEFFERSON PARISH PUB SCH DIST,40-75% (Mid-High),"$48K-51,999",,5,No,Yes,Harvey,Jefferson,LA,70058
00404779,220087000660,ACADIANA HIGH SCHOOL,00404755,LAFAYETTE PARISH SCH DISTRICT,0-40% (Low),"$41K-42,999",9,12,No,No,Lafayette,Lafayette,LA,70506
00397815,220003000013,IOTA ELEMENTARY SCHOOL,00397683,ACADIA PARISH SCHOOL DISTRICT,0-40% (Low),"$48K-51,999",,5,No,No,Iota,Acadia,LA,70543
01827825,220120001008,RISER ELEMENTARY SCHOOL,00410211,OUACHITA PARISH SCHOOL DIST,40-75% (Mid-High),"$41K-42,999",,5,No,No,West Monroe,Ouachita,LA,71292
11452644,220084002268,RAY ST PIERRE ADVANCED STUDIES,00403713,JEFFERSON PARISH PUB SCH DIST,0-40% (Low),"$48K-51,999",,5,No,Yes,Marrero,Jefferson,LA,70072
00410223,220120001012,STERLINGTON ELEMENTARY SCHOOL,00410211,OUACHITA PARISH SCHOOL DIST,0-40% (Low),"$55K-59,999",,5,No,No,Sterlington,Ouachita,LA,71280
00405204,,CATHEDRAL-CARMEL SCHOOL,00405175,DIOCESE OF LAFAYETTE ED OFFICE,,"$1–27,999",,8,No,No,Lafayette,Lafayette,LA,70501
00409092,,OUR LADY PERPETUAL HELP SCHOOL,00408658,ARCHDIOCESE NEW ORLEANS ED OFF,,"$43K-44,999",,8,No,No,Kenner,Jefferson,LA,70062
05345245,220102001720,GRAY'S CREEK ELEMENTARY SCHOOL,00406325,LIVINGSTON PARISH PUB SCHOOLS,0-40% (Low),"$65K-69,999",,5,No,No,Denham Spgs,Livingston,LA,70726
04871447,220162001248,B EDWARD BOUDREAUX MIDDLE SCH,00413328,ST MARY PARISH SCHOOL DISTRICT,40-75% (Mid-High),"$35K-36,999",6,8,No,No,Baldwin,St Mary,LA,70514
12044733,220023502396,ACADIANA RENAISSANCE CHTR ACAD,11914678,CHARTER SCHOOLS USA,40-75% (Mid-High),"$70K-80,999",,8,Yes,No,Youngsville,Lafayette,LA,70592
11128025,220009002081,PECAN GROVE PRIMARY SCHOOL,00398027,ASCENSION PARISH SCHOOLS,40-75% (Mid-High),"$70K-80,999",,5,No,No,Gonzales,Ascension,LA,70737
00414918,220180001569,J H WILLIAMS MIDDLE SCHOOL,00414891,VERMILION PARISH SCHOOL DIST,40-75% (Mid-High),"$48K-51,999",6,8,No,No,Abbeville,Vermilion,LA,70510
00406090,220096000731,JENA ELEMENTARY SCHOOL,00406064,LASALLE PARISH SCHOOL DIST,40-75% (Mid-High),"$32K-34,999",,2,No,No,Jena,La Salle,LA,71342
12317334,,AUDUBON CHARTER SCH-GENTILLY,00407068,ORLEANS PARISH SCHOOL DISTRICT,,"$39K-40,999",,2,Yes,No,New Orleans,Orleans,LA,70122
04810431,,NEW ORLEANS CHARTER SCI & MATH,00407068,ORLEANS PARISH SCHOOL DISTRICT,,"$60K-64,999",9,12,Yes,No,New Orleans,Orleans,LA,70115
00404169,220084000576,JOHN Q ADAMS MIDDLE SCHOOL,00403713,JEFFERSON PARISH PUB SCH DIST,75%+ (High),"$60K-64,999",6,8,No,Yes,Metairie,Jefferson,LA,70003
00411277,220129001563,TIOGA ELEMENTARY SCHOOL,00410766,RAPIDES PARISH SCHOOL DISTRICT,75%+ (High),"$41K-42,999",,6,No,No,Ball,Rapides,LA,71405
00403878,220084000597,EAST JEFFERSON HIGH SCHOOL,00403713,JEFFERSON PARISH PUB SCH DIST,40-75% (Mid-High),"$52K-54,999",9,12,No,No,Metairie,Jefferson,LA,70001
02892287,220102001707,FRENCH SETTLEMENT ELEM SCHOOL,00406325,LIVINGSTON PARISH PUB SCHOOLS,0-40% (Low),"$45K-47,999",,6,No,No,Fr Settlement,Livingston,LA,70733
00414621,220174001359,MONTEGUT MIDDLE SCHOOL,00414384,TERREBONNE PARISH SCHOOL DIST,40-75% (Mid-High),"$35K-36,999",5,8,No,No,Montegut,Terrebonne,LA,70377
00403218,220072000512,DODSON ST ELEMENTARY SCHOOL,00403139,IBERIA PARISH SCHOOL DISTRICT,40-75% (Mid-High),"$52K-54,999",,,No,No,New Iberia,Iberia,LA,70563
00400553,220039000293,SOUTH CAMERON SCHOOL,00400486,CAMERON PARISH SCHOOL DISTRICT,40-75% (Mid-High),"$70K-80,999",,12,No,No,Grand Chenier,Cameron,LA,70643
00410388,220120001002,OUACHITA JUNIOR HIGH SCHOOL,00410211,OUACHITA PARISH SCHOOL DIST,40-75% (Mid-High),"$45K-47,999",6,8,No,No,Monroe,Ouachita,LA,71203
00405917,220090000714,LOCKPORT UPPER ELEM SCHOOL,00405747,LAFOURCHE PARISH SCHOOL DIST,40-75% (Mid-High),"$60K-64,999",3,5,No,No,Lockport,Lafourche,LA,70374
00413249,220159001224,PARKS MIDDLE SCHOOL,00413158,ST MARTIN PARISH SCHOOL DIST,40-75% (Mid-High),"$45K-47,999",5,8,No,No,St Martinvlle,St Martin,LA,70582
05275042,,EDEN PARK SUPT ACADEMY,00401064,EAST BATON ROUGE PARISH SD,,"$28K-31,999",3,5,No,No,Baton Rouge,East Baton Rouge,LA,70802
00413483,,ST MARY PARISH ALT SCHOOL,00413328,ST MARY PARISH SCHOOL DISTRICT,,"$41K-42,999",1,12,No,No,Franklin,St Mary,LA,70538
00403335,220072000525,WESTGATE HIGH SCHOOL,00403139,IBERIA PARISH SCHOOL DISTRICT,75%+ (High),"$35K-36,999",9,12,No,No,New Iberia,Iberia,LA,70560
04848529,220002501000,NEW VISION LEARNING ACADEMY,00397671,LOUISIANA DEPT OF EDUCATION,40-75% (Mid-High),"$48K-51,999",,6,Yes,No,Monroe,Ouachita,LA,71201
00407563,220117000880,WARREN EASTON CHARTER HS,00407068,ORLEANS PARISH SCHOOL DISTRICT,40-75% (Mid-High),"$35K-36,999",9,12,Yes,No,New Orleans,Orleans,LA,70119
00402446,,ST GEORGE CATHOLIC SCHOOL,00402226,DIOCESE OF BATON ROUGE ED OFF,,"$81K-93,999",,8,No,No,Baton Rouge,East Baton Rouge,LA,70809
00408713,,ARCHBISHOP RUMMEL HIGH SCHOOL,00408658,ARCHDIOCESE NEW ORLEANS ED OFF,,"$52K-54,999",8,12,No,No,Metairie,Jefferson,LA,70001
00402264,,CATH ELEM SCHOOL-POINTE COUPEE,00402226,DIOCESE OF BATON ROUGE ED OFF,,"$43K-44,999",,6,No,No,New Roads,Pointe Coupee,LA,70760
12367652,,OPELOUSAS MIDDLE SCHOOL,00412702,ST LANDRY PARISH SCH DIST,,"$32K-34,999",5,6,No,No,Opelousas,St Landry,LA,70570
00402317,,HOLY FAMILY SCHOOL,00402226,DIOCESE OF BATON ROUGE ED OFF,,"$60K-64,999",,8,No,No,Port Allen,West Baton Rouge,LA,70767
11931327,,LA LEARNING ACADEMY,,,,"$65K-69,999",,12,No,No,Denham Spgs,Livingston,LA,70726
00407537,220018600981,SOPHIE B WRIGHT CHARTER SCHOOL,00407068,ORLEANS PARISH SCHOOL DISTRICT,75%+ (High),"$60K-64,999",9,12,Yes,No,New Orleans,Orleans,LA,70115
00409470,,ST GREGORY BARBARIGO SCHOOL,01600641,DIOCESE HOUMA-THIBODAUX ED OFF,,"$45K-47,999",,7,No,No,Houma,Terrebonne,LA,70364
00401703,220054000404,NORTHDALE SUPT'S ACADEMY,00401064,EAST BATON ROUGE PARISH SD,75%+ (High),"$55K-59,999",9,12,No,Yes,Baton Rouge,East Baton Rouge,LA,70815
05301885,,FAITH ACADEMY,,,,"$60K-64,999",,12,No,No,Port Allen,West Baton Rouge,LA,70767
02203569,,ST THOMAS MORE HIGH SCHOOL,00405175,DIOCESE OF LAFAYETTE ED OFFICE,,"$70K-80,999",9,12,No,No,Lafayette,Lafayette,LA,70508
00409406,,ST EDWARD THE CONFESSOR SCHOOL,00408658,ARCHDIOCESE NEW ORLEANS ED OFF,,"$52K-54,999",,8,No,No,Metairie,Jefferson,LA,70001
04922187,220054001384,GREENVILLE SUPT'S ACADEMY,00401064,EAST BATON ROUGE PARISH SD,75%+ (High),"$43K-44,999",6,8,No,No,Baton Rouge,East Baton Rouge,LA,70806
05350317,,SULPHUR HIGH 9TH GRADE CAMPUS,00399722,CALCASIEU PARISH PUBLIC SCH,,"$60K-64,999",9,9,No,No,Sulphur,Calcasieu,LA,70663
00413196,220159001219,BREAUX BRIDGE HIGH SCHOOL,00413158,ST MARTIN PARISH SCHOOL DIST,40-75% (Mid-High),"$45K-47,999",9,12,No,No,Breaux Bridge,St Martin,LA,70517
11735185,220016002327,NEW ORLEANS MILTRY-MARTME ACAD,00397671,LOUISIANA DEPT OF EDUCATION,40-75% (Mid-High),"$28K-31,999",8,12,Yes,No,New Orleans,Orleans,LA,70114
04793869,220114001404,FRANKE R JACKSON TECH CTR,00406820,NATCHITOCHES PARISH SCH DIST,40-75% (Mid-High),"$28K-31,999",,,No,No,Natchitoches,Natchitoches,LA,71457
00409717,,ST MARY'S DOMINICAN HIGH SCH,00408658,ARCHDIOCESE NEW ORLEANS ED OFF,,"$39K-40,999",8,12,No,No,New Orleans,Orleans,LA,70125
00397968,220006000027,KINDER HIGH SCHOOL,00397920,ALLEN PARISH SCHOOL DISTRICT,40-75% (Mid-High),"$55K-59,999",9,12,No,No,Kinder,Allen,LA,70648
11450608,,UNIVERSAL PRE-SCHOOL CENTER,00411851,SABINE PARISH SCHOOL DISTRICT,,"$45K-47,999",,,No,No,Many,Sabine,LA,71449
03103596,,ELMWOOD PARK ACADEMY,,,,"$55K-59,999",,8,No,No,Gretna,Jefferson,LA,70056
00400230,220033000237,SAM HOUSTON HIGH SCHOOL,00399722,CALCASIEU PARISH PUBLIC SCH,0-40% (Low),"$70K-80,999",9,12,No,No,Lake Charles,Calcasieu,LA,70611
00409999,,VANDEBILT CATHOLIC HIGH SCHOOL,01600641,DIOCESE HOUMA-THIBODAUX ED OFF,,"$55K-59,999",8,12,No,No,Houma,Terrebonne,LA,70360
00409810,,ST PETER SCHOOL,00408658,ARCHDIOCESE NEW ORLEANS ED OFF,,"$48K-51,999",,8,No,No,Reserve,St John The Baptist,LA,70084
00406052,220090000727,WEST THIBODAUX MIDDLE SCHOOL,00405747,LAFOURCHE PARISH SCHOOL DIST,40-75% (Mid-High),"$48K-51,999",6,8,No,No,Thibodaux,Lafourche,LA,70301
02864503,,EVANGEL CHRISTIAN ACADEMY,,,,"$37K-38,999",,12,No,No,Shreveport,Caddo,LA,71129
00410895,,RAPIDES ACAD ADV VIRTUAL LRNG,00410766,RAPIDES PARISH SCHOOL DISTRICT,,"$28K-31,999",6,12,No,No,Alexandria,Rapides,LA,71302
00406258,   ,GRAMBLING STATE UNIV HIGH SCH,00397671,LOUISIANA DEPT OF EDUCATION,,"$1–27,999",,,No,No,Grambling,,LA,71245
02483563,,JOHN CURTIS CHRISTIAN HIGH SCH,,,,"$65K-69,999",7,12,No,No,New Orleans,Jefferson,LA,70123
01830664,220069000501,GRANT HIGH SCHOOL,00403050,GRANT PARISH SCHOOL DISTRICT,40-75% (Mid-High),"$48K-51,999",9,12,No,No,Dry Prong,Grant,LA,71423
00402458,,REDEMPTORIST ST GERARD SCHOOL,00402226,DIOCESE OF BATON ROUGE ED OFF,,"$28K-31,999",,8,No,No,Baton Rouge,East Baton Rouge,LA,70805
03047590,220099000742,CHOUDRANT HIGH SCHOOL,00406181,LINCOLN PARISH SCHOOL DISTRICT,0-40% (Low),"$65K-69,999",7,12,No,No,Choudrant,Lincoln,LA,71227
00406375,220102000758,DENHAM SPRINGS HIGH SCHOOL,00406325,LIVINGSTON PARISH PUB SCHOOLS,0-40% (Low),"$65K-69,999",10,12,No,No,Denham Spgs,Livingston,LA,70726
00405589,,ST FRANCIS SCHOOL,00405175,DIOCESE OF LAFAYETTE ED OFFICE,,"$48K-51,999",,8,No,No,Iota,Acadia,LA,70543
00405773,220090000699,CENTRAL LAFOURCHE HIGH SCHOOL,00405747,LAFOURCHE PARISH SCHOOL DIST,40-75% (Mid-High),"$48K-51,999",9,12,No,No,Raceland,Lafourche,LA,70394
00397762,220003000008,CROWLEY KINDERGARTEN,00397683,ACADIA PARISH SCHOOL DISTRICT,75%+ (High),"$32K-34,999",,,No,No,Crowley,Acadia,LA,70526
12106331,,COLLEGE & CAREER READINESS CTR,00413158,ST MARTIN PARISH SCHOOL DIST,,"$45K-47,999",9,12,No,No,Breaux Bridge,St Martin,LA,70517
00405577,,ST EDWARD SCHOOL,00405175,DIOCESE OF LAFAYETTE ED OFFICE,,"$35K-36,999",,3,No,No,New Iberia,Iberia,LA,70560
00402472,,ST JOHN HIGH SCHOOL,00402226,DIOCESE OF BATON ROUGE ED OFF,,"$52K-54,999",,12,No,No,Plaquemine,Iberville,LA,70764
00398144,220009000044,PRAIRIEVILLE MIDDLE SCHOOL,00398027,ASCENSION PARISH SCHOOLS,0-40% (Low),"$81K-93,999",6,8,No,No,Prairieville,Ascension,LA,70769
00403880,220084000598,JOHN EHRET HIGH SCHOOL,00403713,JEFFERSON PARISH PUB SCH DIST,40-75% (Mid-High),"$48K-51,999",9,12,No,No,Marrero,Jefferson,LA,70072
00408933,,ACADEMY OF OUR LADY,00408658,ARCHDIOCESE NEW ORLEANS ED OFF,,"$48K-51,999",8,12,No,No,Marrero,Jefferson,LA,70072
01782794,,KINGSTON CHRISTIAN ACADEMY,,,,"$41K-42,999",,12,No,No,Shreveport,Caddo,LA,71118
00410247,220120001939,WEST OUACHITA HIGH SCHOOL,00410211,OUACHITA PARISH SCHOOL DIST,40-75% (Mid-High),"$41K-42,999",9,12,No,No,West Monroe,Ouachita,LA,71292
00409901,,ST ROSALIE SCHOOL,00408658,ARCHDIOCESE NEW ORLEANS ED OFF,,"$48K-51,999",,7,No,No,Harvey,Jefferson,LA,70058
12038722,220019002386,IMPACT CHARTER ELEMENTARY SCH,00397671,LOUISIANA DEPT OF EDUCATION,40-75% (Mid-High),,,8,Yes,No,Baton Rouge,East Baton Rouge,LA,70874
11735111,220054002324,CAREER ACADEMY,00401064,EAST BATON ROUGE PARISH SD,75%+ (High),,,,Yes,No,Baton Rouge,,LA,70805
00409767,,ST MICHAEL SPECIAL SCHOOL,00408658,ARCHDIOCESE NEW ORLEANS ED OFF,,"$60K-64,999",,,No,No,New Orleans,Orleans,LA,70130
00413524,220162001252,MORGAN CITY JUNIOR HIGH SCHOOL,00413328,ST MARY PARISH SCHOOL DISTRICT,40-75% (Mid-High),"$39K-40,999",6,8,No,No,Morgan City,St Mary,LA,70380
01446457,,JOHN CURTIS CHRN LOWER SCHOOL,,,,"$65K-69,999",,6,No,No,New Orleans,Jefferson,LA,70123
00411746,220135001096,DELHI MIDDLE SCHOOL,00411710,RICHLAND PARISH SCHOOL DIST,75%+ (High),"$37K-38,999",5,8,No,No,Delhi,Richland,LA,71232
00414906,220180001385,ABBEVILLE HIGH SCHOOL,00414891,VERMILION PARISH SCHOOL DIST,40-75% (Mid-High),"$48K-51,999",9,12,No,No,Abbeville,Vermilion,LA,70510
00413433,220162001242,FRANKLIN SENIOR HIGH SCHOOL,00413328,ST MARY PARISH SCHOOL DISTRICT,40-75% (Mid-High),"$41K-42,999",9,12,No,No,Franklin,St Mary,LA,70538
00408189,220025600885,WILLIAM J FISCHER ACCEL ACAD,11913430,ALGIERS CHARTER SCHOOL ASSOC,75%+ (High),"$28K-31,999",,,Yes,No,New Orleans,Orleans,LA,70114
00402654,220060000461,EAST FELICIANA MIDDLE SCHOOL,00402642,EAST FELICIANA PARISH SCH DIST,75%+ (High),"$48K-51,999",6,8,No,No,Clinton,East Feliciana,LA,70722
00398118,220009000039,GALVEZ MIDDLE SCHOOL,00398027,ASCENSION PARISH SCHOOLS,0-40% (Low),"$81K-93,999",6,8,No,No,Prairieville,Ascension,LA,70769
00412348,220147001154,ST HELENA CLG & CAREER ACAD,00412324,ST HELENA PARISH SCHOOL DIST,75%+ (High),"$39K-40,999",7,12,No,No,Greensburg,St Helena,LA,70441
11564285,220099002304,LINCOLN PARISH ECC,00406181,LINCOLN PARISH SCHOOL DISTRICT,0-40% (Low),"$35K-36,999",,,No,No,Ruston,Lincoln,LA,71270
00400826,220048000317,FERRIDAY HIGH SCHOOL,00400802,CONCORDIA PARISH SCHOOL DIST,75%+ (High),"$1–27,999",9,12,No,No,Ferriday,Concordia,LA,71334
12171142,220168002399,TANGIPAHOA ALT SOLUTIONS PGRM,00413976,TANGIPAHOA PARISH SCHOOL DIST,0-40% (Low),"$45K-47,999",5,12,No,No,Hammond,Tangipahoa,LA,70401
00406595,220105000780,MADISON HIGH SCHOOL,00406569,MADISON PARISH SCHOOL DIST,75%+ (High),"$32K-34,999",9,12,No,No,Tallulah,Madison,LA,71282
00403309,220072000523,LOREAUVILLE HIGH SCHOOL,00403139,IBERIA PARISH SCHOOL DISTRICT,0-40% (Low),"$41K-42,999",7,12,No,No,Loreauville,Iberia,LA,70552
02487959,,MONTESSORI EDUCATIONAL CENTER,,,,"$48K-51,999",,8,No,No,Alexandria,Rapides,LA,71303
00413299,220159001229,ST MARTINVILLE SR HIGH SCHOOL,00413158,ST MARTIN PARISH SCHOOL DIST,75%+ (High),"$45K-47,999",9,12,No,No,St Martinvlle,St Martin,LA,70582
12313560,,IDEA CLG PREP-BRIDGE,12372592,IDEA PUBLIC SCHOOLS S LOUISANA,,"$55K-59,999",6,7,Yes,No,Baton Rouge,East Baton Rouge,LA,70815
01446720,,RIVER OAKS SCHOOL,,,,"$45K-47,999",,12,No,No,Monroe,Ouachita,LA,71203
04752920,,BAYOU CANE ADULT CENTER,00414384,TERREBONNE PARISH SCHOOL DIST,,"$55K-59,999",,,No,No,Houma,Terrebonne,LA,70360
02115285,,ASCENSION OF OUR LORD SCHOOL,00408658,ARCHDIOCESE NEW ORLEANS ED OFF,,"$60K-64,999",,8,No,No,La Place,St John The Baptist,LA,70068
00410675,220126001029,LIVONIA HIGH SCHOOL,00410651,POINTE COUPEE PARISH SCH DIST,40-75% (Mid-High),"$55K-59,999",7,12,No,No,Livonia,Pointe Coupee,LA,70755
00405228,,CATHOLIC HIGH SCHOOL,00405175,DIOCESE OF LAFAYETTE ED OFFICE,,"$35K-36,999",4,12,No,No,New Iberia,Iberia,LA,70560
00405864,220090000708,GOLDEN MEADOW UPPER ELEM SCH,00405747,LAFOURCHE PARISH SCHOOL DIST,75%+ (High),"$52K-54,999",3,5,No,No,Golden Meadow,Lafourche,LA,70357
10758598,220023802341,WALTER L COHEN COLLEGE PREP HS,00407068,ORLEANS PARISH SCHOOL DISTRICT,75%+ (High),"$1–27,999",9,12,No,No,New Orleans,Orleans,LA,70113
11559993,220015302300,LAGNIAPPE ACAD CHARTER SCHOOL,10029737,RECOVERY SCHOOL DISTRICT,,,,,No,No,New Orleans,,LA,70112
00411813,220135001102,RAYVILLE HIGH SCHOOL,00411710,RICHLAND PARISH SCHOOL DIST,40-75% (Mid-High),"$37K-38,999",9,12,No,No,Rayville,Richland,LA,71269
03016852,,ARCHBISHOP HANNAN HIGH SCHOOL,00408658,ARCHDIOCESE NEW ORLEANS ED OFF,,"$70K-80,999",8,12,No,No,Covington,St Tammany,LA,70433
02896453,,NORCO ADULT LEARNING CENTER,00412154,ST CHARLES PARISH PUBLIC SD,,"$70K-80,999",,,No,No,Norco,St Charles,LA,70079
12233257,,SOUTHSIDE HIGH SCHOOL,00404755,LAFAYETTE PARISH SCH DISTRICT,,"$70K-80,999",9,11,No,Yes,Youngsville,Lafayette,LA,70592
00401105,220004000344,BAKER HIGH SCHOOL,05256905,CITY OF BAKER SCHOOL SYSTEM,75%+ (High),"$55K-59,999",9,12,No,No,Baker,East Baton Rouge,LA,70714
01524499,220102000777,WESTSIDE JUNIOR HIGH SCHOOL,00406325,LIVINGSTON PARISH PUB SCHOOLS,0-40% (Low),"$60K-64,999",6,8,No,No,Walker,Livingston,LA,70785
01446665,,OUACHITA CHRISTIAN SCHOOL,,,,"$45K-47,999",,12,No,No,Monroe,Ouachita,LA,71203
00411928,220138001114,NEGREET HIGH SCHOOL,00411851,SABINE PARISH SCHOOL DISTRICT,40-75% (Mid-High),,,12,No,No,Negreet,Sabine,LA,71460
