00413897,220165001289,PINE VIEW MIDDLE SCHOOL,00413639,ST TAMMANY PARISH SCH DISTRICT,40-75% (Mid-High),"$70K-80,999",4,6,No,Yes,Covington,St Tammany,LA,70433
12369349,,DR RAPHAEL BARANCO ELEM SCHOOL,00404755,LAFAYETTE PARISH SCH DISTRICT,,"$1–27,999",,5,No,Yes,Lafayette,Lafayette,LA,70501
00404391,220084000614,T H HARRIS MIDDLE SCHOOL,00403713,JEFFERSON PARISH PUB SCH DIST,40-75% (Mid-High),"$60K-64,999",6,8,No,Yes,Metairie,Jefferson,LA,70003
00411148,220129001069,PINEVILLE HIGH SCHOOL,00410766,RAPIDES PARISH SCHOOL DISTRICT,40-75% (Mid-High),"$48K-51,999",9,12,No,No,Pineville,Rapides,LA,71360
00410950,220129001081,LESSIE MOORE ELEMENTARY SCHOOL,00410766,RAPIDES PARISH SCHOOL DISTRICT,40-75% (Mid-High),"$48K-51,999",,3,No,No,Pineville,Rapides,LA,71360
00411552,,ST MARY'S SCHOOL,00411289,DIOCESE OF ALEXANDRIA ED OFF,,"$28K-31,999",,12,No,No,Natchitoches,Natchitoches,LA,71457
00402123,220054000445,WILDWOOD ELEMENTARY SCHOOL,00401064,EAST BATON ROUGE PARISH SD,40-75% (Mid-High),$94K+,,5,No,Yes,Baton Rouge,East Baton Rouge,LA,70810
05325403,,CHRIST EPISCOPAL SCHOOL,,,,"$70K-80,999",,12,No,No,Covington,St Tammany,LA,70433
00412386,220147001157,ST HELENA ARTS & TECH ACADEMY,00412324,ST HELENA PARISH SCHOOL DIST,75%+ (High),"$39K-40,999",3,6,No,Yes,Greensburg,St Helena,LA,70441
00400319,220033000270,VINTON HIGH SCHOOL,00399722,CALCASIEU PARISH PUBLIC SCH,40-75% (Mid-High),"$55K-59,999",9,12,No,No,Vinton,Calcasieu,LA,70668
04370314,220021700414,DR KING CHARTER SCHOOL,11930725,FRIENDS OF KING SCHOOLS,75%+ (High),"$28K-31,999",,12,Yes,No,New Orleans,Orleans,LA,70117
01400702,220180001568,RENE A ROST MIDDLE SCHOOL,00414891,VERMILION PARISH SCHOOL DIST,0-40% (Low),"$45K-47,999",5,8,No,Yes,Kaplan,Vermilion,LA,70548
01527441,220006000030,OAKDALE MIDDLE SCHOOL,00397920,ALLEN PARISH SCHOOL DISTRICT,40-75% (Mid-High),"$37K-38,999",5,8,No,No,Oakdale,Allen,LA,71463
03052961,220174001952,GRAND CAILLOU MIDDLE SCHOOL,00414384,TERREBONNE PARISH SCHOOL DIST,40-75% (Mid-High),"$28K-31,999",5,8,No,No,Houma,Terrebonne,LA,70363
00413093,220156001212,SOUTHWEST ELEMENTARY SCHOOL,00412702,ST LANDRY PARISH SCH DIST,75%+ (High),"$1–27,999",,,No,No,Opelousas,St Landry,LA,70570
11735109,220090002330,BAYOU CMTY ACADEMY,00405747,LAFOURCHE PARISH SCHOOL DIST,0-40% (Low),"$48K-51,999",,8,Yes,No,Thibodaux,Lafourche,LA,70301
12112990,220019402418,TANGI ACADEMY,00397671,LOUISIANA DEPT OF EDUCATION,0-40% (Low),"$48K-51,999",,8,Yes,No,Hammond,Tangipahoa,LA,70403
00406753,220111000804,HENRY V ADAMS ELEMENTARY SCH,00406650,MOREHOUSE PARISH SCHOOL DIST,40-75% (Mid-High),"$32K-34,999",,,No,Yes,Bastrop,Morehouse,LA,71220
00400216,220033000276,S J WELSH MIDDLE SCHOOL,00399722,CALCASIEU PARISH PUBLIC SCH,40-75% (Mid-High),"$70K-80,999",6,8,No,No,Lake Charles,Calcasieu,LA,70605
00398247,220012000054,NAPOLEONVILLE MIDDLE SCHOOL,00398168,ASSUMPTION PARISH SCHOOL DIST,40-75% (Mid-High),"$48K-51,999",5,8,No,Yes,Napoleonville,Assumption,LA,70390
00410962,220129001055,ARTHUR F SMITH MID MAGNET SCH,00410766,RAPIDES PARISH SCHOOL DISTRICT,75%+ (High),"$28K-31,999",7,8,No,No,Alexandria,Rapides,LA,71302
02203557,,ST BERNARD SCHOOL,00405175,DIOCESE OF LAFAYETTE ED OFFICE,,"$45K-47,999",,8,No,No,Breaux Bridge,St Martin,LA,70517
00415429,220186001425,MT HERMON SCHOOL,00415352,WASHINGTON PARISH SCHOOL DIST,40-75% (Mid-High),"$32K-34,999",,12,No,No,Mount Hermon,Washington,LA,70450
00406715,220111000819,PINE GROVE ELEMENTARY SCHOOL,00406650,MOREHOUSE PARISH SCHOOL DIST,40-75% (Mid-High),"$32K-34,999",,,No,Yes,Bastrop,Morehouse,LA,71220
00415182,220183001415,ROSEPINE HIGH SCHOOL,00415089,VERNON PARISH SCHOOL DISTRICT,40-75% (Mid-High),,7,12,No,No,Rosepine,Vernon,LA,70659
11563009,,DESOTO GRACE HOUSE,00400943,DESOTO PARISH SCHOOL DISTRICT,,"$28K-31,999",6,12,No,No,Mansfield,De Soto,LA,71052
00401363,220022302403,CELERITY CRESTWORTH CHTR SCH,10029737,RECOVERY SCHOOL DISTRICT,40-75% (Mid-High),"$32K-34,999",,8,Yes,No,Baton Rouge,East Baton Rouge,LA,70807
00414334,220171001330,NEWELLTON ELEMENTARY SCHOOL,00414308,TENSAS PARISH SCHOOL DISTRICT,75%+ (High),"$28K-31,999",,,No,No,Newellton,,LA,71357
00409303,,ST AUGUSTINE HIGH SCHOOL,00408658,ARCHDIOCESE NEW ORLEANS ED OFF,,"$35K-36,999",6,12,No,No,New Orleans,Orleans,LA,70119
00411057,220129001045,MABEL BRASHER ELEM SCHOOL,00410766,RAPIDES PARISH SCHOOL DISTRICT,75%+ (High),"$48K-51,999",,5,No,No,Alexandria,Rapides,LA,71303
00415821,220195001467,EPPS HIGH SCHOOL,00415819,WEST CARROLL PARISH SCH DIST,75%+ (High),"$37K-38,999",,12,No,No,Epps,West Carroll,LA,71237
10914118,220022802357,MARY D COGHILL CHARTER SCHOOL,00407068,ORLEANS PARISH SCHOOL DISTRICT,75%+ (High),"$1–27,999",,8,Yes,No,New Orleans,Orleans,LA,70126
00400113,220033000257,OAK PARK MIDDLE SCHOOL,00399722,CALCASIEU PARISH PUBLIC SCH,40-75% (Mid-High),"$37K-38,999",6,8,No,No,Lake Charles,Calcasieu,LA,70601
05090830,,SABINE CAREER ACADEMY,00411851,SABINE PARISH SCHOOL DISTRICT,,"$43K-44,999",,,No,No,Many,Sabine,LA,71449
11918806,,K12 CHRISTIAN ACADEMY,,,,"$32K-34,999",,,No,No,Ville Platte,Evangeline,LA,70586
00411801,220135001101,MANGHAM JUNIOR HIGH SCHOOL,00411710,RICHLAND PARISH SCHOOL DIST,40-75% (Mid-High),"$41K-42,999",6,8,No,No,Mangham,Richland,LA,71259
02907234,220001701975,LA SCH FOR MATH SCIENCE & ARTS,00397671,LOUISIANA DEPT OF EDUCATION,0-40% (Low),"$28K-31,999",10,12,No,No,Natchitoches,Natchitoches,LA,71457
00405931,220090000716,RACELAND MIDDLE SCHOOL,00405747,LAFOURCHE PARISH SCHOOL DIST,40-75% (Mid-High),"$48K-51,999",6,8,No,No,Raceland,Lafourche,LA,70394
00411796,220135001100,MANGHAM HIGH SCHOOL,00411710,RICHLAND PARISH SCHOOL DIST,40-75% (Mid-High),"$41K-42,999",9,12,No,No,Mangham,Richland,LA,71259
04992091,,BELMONT UNION CHRISTIAN ACAD,,,,"$45K-47,999",,12,No,No,Belmont,Sabine,LA,71406
00404248,220084000631,LIVE OAK MANOR ELEM SCHOOL,00403713,JEFFERSON PARISH PUB SCH DIST,75%+ (High),"$37K-38,999",,5,No,No,Westwego,Jefferson,LA,70094
04329602,,EVANGEL CHRISTIAN ACADEMY ES,,,,"$37K-38,999",,6,No,No,Shreveport,Caddo,LA,71129
11927455,220023702068,ABRAMSON SCI ACADEMY,12115203,COLLEGIATE ACADEMIES,40-75% (Mid-High),"$1–27,999",9,12,Yes,No,New Orleans,Orleans,LA,70127
01445972,,SILLIMAN INSTITUTE,,,,"$48K-51,999",,12,No,No,Clinton,East Feliciana,LA,70722
00414217,220168001319,PONCHATOULA HIGH SCHOOL,00413976,TANGIPAHOA PARISH SCHOOL DIST,0-40% (Low),"$60K-64,999",9,12,No,No,Ponchatoula,Tangipahoa,LA,70454
12367743,,UNION PARISH ALTERNATIVE CTR,00414774,UNION PARISH SCHOOL DISTRICT,,"$45K-47,999",6,12,No,No,Farmerville,Union,LA,71241
00413548,220162001254,PATTERSON SENIOR HIGH SCHOOL,00413328,ST MARY PARISH SCHOOL DISTRICT,40-75% (Mid-High),"$45K-47,999",9,12,No,No,Patterson,St Mary,LA,70392
00404743,220081000575,WELSH-ROANOKE JR HIGH SCHOOL,00404597,JEFFERSON DAVIS PARISH SD,0-40% (Low),"$60K-64,999",6,8,No,No,Roanoke,Jefferson Davis,LA,70581
05371218,,BALDWIN CHRISTIAN ACADEMY,,,,"$35K-36,999",,3,No,No,Baldwin,St Mary,LA,70514
02903434,,ST THOMAS AQUINAS HIGH SCHOOL,00402226,DIOCESE OF BATON ROUGE ED OFF,,"$45K-47,999",9,12,No,No,Hammond,Tangipahoa,LA,70401
10005573,220102001678,LIVINGSTON LITERACY & TECH CTR,00406325,LIVINGSTON PARISH PUB SCHOOLS,,"$60K-64,999",11,12,No,No,Walker,Livingston,LA,70785
00409729,,ST MARY'S NATIVITY SCHOOL,01600641,DIOCESE HOUMA-THIBODAUX ED OFF,,"$48K-51,999",,8,No,No,Raceland,Lafourche,LA,70394
00399186,220030000161,FAIR PARK COLLEGE PREP ACADEMY,00398962,CADDO PARISH PUBLIC SCHOOLS,75%+ (High),"$1–27,999",,,No,No,Shreveport,,LA,71109
11830761,,LIGHT CITY CHRISTIAN ACADEMY,,,,"$28K-31,999",,8,No,No,New Orleans,Orleans,LA,70117
02993300,,VICTORY CHRISTIAN ACADEMY,,,,"$60K-64,999",,8,No,No,Metairie,Jefferson,LA,70003
00405527,,SACRED HEART SCHOOL,00405175,DIOCESE OF LAFAYETTE ED OFFICE,,"$32K-34,999",,8,No,No,Ville Platte,Evangeline,LA,70586
00410742,220126001034,UPPER POINTE COUPEE ELEM SCH,00410651,POINTE COUPEE PARISH SCH DIST,40-75% (Mid-High),"$41K-42,999",,8,No,No,Batchelor,Pointe Coupee,LA,70715
00412881,220156001189,KROTZ SPRINGS ELEM SCHOOL,00412702,ST LANDRY PARISH SCH DIST,40-75% (Mid-High),"$1–27,999",,8,No,Yes,Krotz Springs,St Landry,LA,70750
00400747,220045000310,HOMER ELEMENTARY SCHOOL,00400682,CLAIBORNE PARISH SCHOOL DIST,75%+ (High),"$1–27,999",,4,No,Yes,Homer,Claiborne,LA,71040
00403737,220084000583,ALICE BIRNEY ELEMENTARY SCHOOL,00403713,JEFFERSON PARISH PUB SCH DIST,40-75% (Mid-High),"$65K-69,999",,5,No,Yes,Metairie,Jefferson,LA,70006
00415132,220183001409,HORNBECK HIGH SCHOOL,00415089,VERNON PARISH SCHOOL DISTRICT,40-75% (Mid-High),"$45K-47,999",,12,No,No,Hornbeck,Vernon,LA,71439
04867135,220027000134,PLATT ELEMENTARY SCHOOL,00398687,BOSSIER PARISH SCHOOL DIST,40-75% (Mid-High),"$48K-51,999",2,3,No,Yes,Haughton,Bossier,LA,71037
10914053,220020102410,RENEW MCDONOGH CITY PARK ACAD,11912058,RENEW SCHOOLS INC,,"$32K-34,999",,,Yes,No,New Orleans,,LA,70119
00398936,220027000138,SUN CITY ELEMENTARY SCHOOL,00398687,BOSSIER PARISH SCHOOL DIST,0-40% (Low),"$48K-51,999",,3,No,Yes,Bossier City,Bossier,LA,71112
00414229,220168001320,D C REEVES ELEMENTARY SCHOOL,00413976,TANGIPAHOA PARISH SCHOOL DIST,40-75% (Mid-High),"$60K-64,999",3,4,No,Yes,Ponchatoula,Tangipahoa,LA,70454
02222876,220084001680,PAUL J SOLIS ELEMENTARY SCHOOL,00403713,JEFFERSON PARISH PUB SCH DIST,40-75% (Mid-High),"$55K-59,999",,5,No,Yes,Gretna,Jefferson,LA,70056
00397944,220006000025,FAIRVIEW HIGH SCHOOL,00397920,ALLEN PARISH SCHOOL DISTRICT,40-75% (Mid-High),,,12,No,No,Grant,Allen,LA,70644
12108470,220084002417,BONELLA A ST VILLE ELEM SCH,00403713,JEFFERSON PARISH PUB SCH DIST,40-75% (Mid-High),"$48K-51,999",,5,No,Yes,Harvey,Jefferson,LA,70058
05012448,220129001066,PEABODY MONTESSORI ELEM SCHOOL,00410766,RAPIDES PARISH SCHOOL DISTRICT,40-75% (Mid-High),"$28K-31,999",,6,No,No,Alexandria,Rapides,LA,71302
00401428,220054000375,FOREST HTS ACAD OF EXCELLENCE,00401064,EAST BATON ROUGE PARISH SD,75%+ (High),"$43K-44,999",,5,No,Yes,Baton Rouge,East Baton Rouge,LA,70812
00401741,220054000408,PARK FOREST ELEMENTARY SCHOOL,00401064,EAST BATON ROUGE PARISH SD,40-75% (Mid-High),"$60K-64,999",,5,No,Yes,Baton Rouge,East Baton Rouge,LA,70814
00400101,220033000256,OAK PARK ELEMENTARY SCHOOL,00399722,CALCASIEU PARISH PUBLIC SCH,40-75% (Mid-High),"$37K-38,999",,5,No,No,Lake Charles,Calcasieu,LA,70601
00403892,220084000595,ELLA DOLHONDE ELEM SCHOOL,00403713,JEFFERSON PARISH PUB SCH DIST,40-75% (Mid-High),"$52K-54,999",,5,No,Yes,Metairie,Jefferson,LA,70001
00399605,220030000202,SUNSET ACRES ELEMENTARY SCHOOL,00398962,CADDO PARISH PUBLIC SCHOOLS,75%+ (High),"$28K-31,999",,5,No,Yes,Shreveport,Caddo,LA,71108
00415417,220186001423,FRANKLINTON PRIMARY SCHOOL,00415352,WASHINGTON PARISH SCHOOL DIST,40-75% (Mid-High),"$39K-40,999",,2,No,No,Franklinton,Washington,LA,70438
00399198,220030000160,FAIRFIELD MAGNET ELEM SCHOOL,00398962,CADDO PARISH PUBLIC SCHOOLS,0-40% (Low),"$48K-51,999",,5,No,Yes,Shreveport,Caddo,LA,71106
00405137,220087000694,WOODVALE ELEMENTARY SCHOOL,00404755,LAFAYETTE PARISH SCH DISTRICT,0-40% (Low),"$65K-69,999",,4,No,Yes,Lafayette,Lafayette,LA,70503
00404858,220087000681,EDGAR A MARTIN MIDDLE SCHOOL,00404755,LAFAYETTE PARISH SCH DISTRICT,0-40% (Low),"$65K-69,999",5,8,No,Yes,Lafayette,Lafayette,LA,70503
00399459,220030002424,NORTH CADDO ELEM MID SCHOOL,00398962,CADDO PARISH PUBLIC SCHOOLS,40-75% (Mid-High),"$28K-31,999",,8,No,Yes,Vivian,Caddo,LA,71082
04286529,220165010403,TCHEFUNCTE MIDDLE SCHOOL,00413639,ST TAMMANY PARISH SCH DISTRICT,0-40% (Low),"$81K-93,999",4,6,No,No,Mandeville,St Tammany,LA,70471
11448124,,MATH SCI & ARTS ACADEMY-WEST,00403414,IBERVILLE PARISH SCHOOL DIST,,,,12,No,Yes,Plaquemine,Iberville,LA,70765
00399148,220030000156,CRESWELL ELEMENTARY SCHOOL,00398962,CADDO PARISH PUBLIC SCHOOLS,75%+ (High),"$35K-36,999",,5,No,Yes,Shreveport,Caddo,LA,71104
00401325,220054000365,NORTHEAST HIGH SCHOOL,00401064,EAST BATON ROUGE PARISH SD,75%+ (High),"$70K-80,999",7,12,No,Yes,Pride,East Baton Rouge,LA,70770
00406076,220096000729,FELLOWSHIP ELEMENTARY SCHOOL,00406064,LASALLE PARISH SCHOOL DIST,0-40% (Low),"$41K-42,999",,5,No,No,Trout,La Salle,LA,71371
11074773,220165002089,LITTLE PEARL ELEMENTARY SCHOOL,00413639,ST TAMMANY PARISH SCH DISTRICT,40-75% (Mid-High),"$48K-51,999",,,No,No,Pearl River,St Tammany,LA,70452
00414956,220180001389,EATON PARK ELEMENTARY SCHOOL,00414891,VERMILION PARISH SCHOOL DIST,75%+ (High),"$48K-51,999",,2,No,Yes,Abbeville,Vermilion,LA,70510
00404119,220084000624,HAROLD KELLER ELEM SCHOOL,00403713,JEFFERSON PARISH PUB SCH DIST,0-40% (Low),"$60K-64,999",,5,No,Yes,Metairie,Jefferson,LA,70003
11450359,220180002273,LEBLANC ELEMENTARY SCHOOL,00414891,VERMILION PARISH SCHOOL DIST,40-75% (Mid-High),"$48K-51,999",,5,No,Yes,Abbeville,Vermilion,LA,70510
00404406,220084000649,TERRYTOWN ELEMENTARY SCHOOL,00403713,JEFFERSON PARISH PUB SCH DIST,40-75% (Mid-High),"$55K-59,999",,5,No,Yes,Gretna,Jefferson,LA,70056
00398584,220021000090,ARCADIA HIGH SCHOOL,00398572,BIENVILLE PARISH SCHOOL DIST,75%+ (High),"$28K-31,999",6,12,No,No,Arcadia,Bienville,LA,71001
00405462,,OUR MOTHER OF PEACE SCHOOL,00405175,DIOCESE OF LAFAYETTE ED OFFICE,,"$48K-51,999",,8,No,No,Church Point,Acadia,LA,70525
00397956,220006000026,KINDER ELEMENTARY SCHOOL,00397920,ALLEN PARISH SCHOOL DISTRICT,40-75% (Mid-High),"$55K-59,999",,4,No,No,Kinder,Allen,LA,70648
04033683,220144000243,ETHEL SCHOEFFNER ELEM SCHOOL,00412154,ST CHARLES PARISH PUBLIC SD,40-75% (Mid-High),"$81K-93,999",3,5,No,No,Destrehan,St Charles,LA,70047
00414712,220174001368,TERREBONNE HIGH SCHOOL,00414384,TERREBONNE PARISH SCHOOL DIST,40-75% (Mid-High),"$55K-59,999",9,12,No,No,Houma,Terrebonne,LA,70360
00407381,220024200917,RENEW SCITECH ACADEMY,11912058,RENEW SCHOOLS INC,40-75% (Mid-High),"$60K-64,999",,8,Yes,Yes,New Orleans,Orleans,LA,70130
00410807,220129001039,ALEXANDRIA MIDDLE MAGNET SCH,00410766,RAPIDES PARISH SCHOOL DISTRICT,75%+ (High),"$32K-34,999",7,8,No,No,Alexandria,Rapides,LA,71301
00414011,220168001299,CHAMP COOPER ELEMENTARY SCHOOL,00413976,TANGIPAHOA PARISH SCHOOL DIST,0-40% (Low),"$60K-64,999",,8,No,Yes,Ponchatoula,Tangipahoa,LA,70454
00413926,220165001293,SIXTH WARD ELEMENTARY SCHOOL,00413639,ST TAMMANY PARISH SCH DISTRICT,75%+ (High),"$48K-51,999",,5,No,Yes,Pearl River,St Tammany,LA,70452
00402927,220066000484,BASKIN ELEMENTARY SCHOOL,00402915,FRANKLIN PARISH SCHOOL DIST,40-75% (Mid-High),"$55K-59,999",,8,No,Yes,Baskin,Franklin,LA,71219
00410986,220129001078,L S RUGG ELEMENTARY SCHOOL,00410766,RAPIDES PARISH SCHOOL DISTRICT,75%+ (High),"$32K-34,999",4,5,No,No,Alexandria,Rapides,LA,71301
00413160,220159001216,BREAUX BRIDGE ELEM SCHOOL,00413158,ST MARTIN PARISH SCHOOL DIST,75%+ (High),"$45K-47,999",3,5,No,No,Breaux Bridge,St Martin,LA,70517
00398285,220015000061,BUNKIE ELEM LEARNING ACADEMY,00398261,AVOYELLES PARISH SCHOOL DIST,75%+ (High),"$35K-36,999",,6,No,Yes,Bunkie,Avoyelles,LA,71322
00405096,220087000691,TRUMAN EARLY CHILDHOOD ED CNTR,00404755,LAFAYETTE PARISH SCH DISTRICT,75%+ (High),"$1–27,999",,,No,No,Lafayette,Lafayette,LA,70501
00411899,220138001111,MANY ELEMENTARY SCHOOL,00411851,SABINE PARISH SCHOOL DISTRICT,40-75% (Mid-High),"$45K-47,999",,4,No,No,Many,Sabine,LA,71449
00398194,220012000050,BELLE ROSE MIDDLE SCHOOL,00398168,ASSUMPTION PARISH SCHOOL DIST,75%+ (High),"$45K-47,999",5,8,No,Yes,Belle Rose,Assumption,LA,70341
01531258,220054000340,ARLINGTON PREPARATORY ACADEMY,00401064,EAST BATON ROUGE PARISH SD,40-75% (Mid-High),"$28K-31,999",9,12,No,No,Baton Rouge,East Baton Rouge,LA,70820
00398390,220015000073,MARKSVILLE HIGH SCHOOL,00398261,AVOYELLES PARISH SCHOOL DIST,75%+ (High),"$39K-40,999",7,12,No,No,Marksville,Avoyelles,LA,71351
00403244,220072000516,JEANERETTE ELEMENTARY SCHOOL,00403139,IBERIA PARISH SCHOOL DISTRICT,75%+ (High),"$37K-38,999",,,No,No,Jeanerette,Iberia,LA,70544
12037948,,WEST END INSTRUCTIONAL CENTER,00404597,JEFFERSON DAVIS PARISH SD,,"$37K-38,999",11,12,No,No,Jennings,Jefferson Davis,LA,70546
01808702,220084000636,J D MEISLER MIDDLE SCHOOL,00403713,JEFFERSON PARISH PUB SCH DIST,40-75% (Mid-High),"$60K-64,999",6,8,No,Yes,Metairie,Jefferson,LA,70002
11563346,220033000225,DEQUINCY PRIMARY SCHOOL,00399722,CALCASIEU PARISH PUBLIC SCH,40-75% (Mid-High),"$52K-54,999",,2,No,No,Dequincy,Calcasieu,LA,70633
01845619,220021000094,CRAWFORD ELEMENTARY SCHOOL,00398572,BIENVILLE PARISH SCHOOL DIST,40-75% (Mid-High),"$28K-31,999",,5,No,Yes,Arcadia,Bienville,LA,71001
00400371,220033000277,WESTERN HEIGHTS ELEMENTARY SCH,00399722,CALCASIEU PARISH PUBLIC SCH,0-40% (Low),"$60K-64,999",3,5,No,No,Westlake,Calcasieu,LA,70669
00414061,220168001304,HAMMOND HIGH MAGNET SCHOOL,00413976,TANGIPAHOA PARISH SCHOOL DIST,0-40% (Low),"$45K-47,999",9,12,No,No,Hammond,Tangipahoa,LA,70401
04915756,,CAREER TECH & ALT CENTER,00412415,ST JAMES PARISH SCHOOL DIST,,"$60K-64,999",9,12,No,No,Lutcher,St James,LA,70071
00413988,220168001298,AMITE HIGH MAGNET SCHOOL,00413976,TANGIPAHOA PARISH SCHOOL DIST,40-75% (Mid-High),"$37K-38,999",9,12,No,No,Amite,Tangipahoa,LA,70422
12107921,,ACADIA PARISH ALTERNATIVE SCH,00397683,ACADIA PARISH SCHOOL DISTRICT,,"$32K-34,999",6,12,No,No,Crowley,Acadia,LA,70526
11223106,,ANNA'S PLACE NOLA,,,,"$37K-38,999",,12,No,No,New Orleans,Orleans,LA,70116
00406686,220111002359,BEEKMAN CHARTER SCHOOL,00406650,MOREHOUSE PARISH SCHOOL DIST,75%+ (High),"$32K-34,999",,12,Yes,No,Bastrop,Morehouse,LA,71220
04837427,,WESTMINSTER CHRISTIAN ACADEMY,,,,"$70K-80,999",,12,No,No,Lafayette,Lafayette,LA,70508
00403696,220078000557,JONESBORO HODGE MIDDLE SCHOOL,00403608,JACKSON PARISH SCHOOL DISTRICT,75%+ (High),"$35K-36,999",6,8,No,Yes,Jonesboro,Jackson,LA,71251
03246306,220072001926,SUGARLAND ELEMENTARY SCHOOL,00403139,IBERIA PARISH SCHOOL DISTRICT,40-75% (Mid-High),"$35K-36,999",,6,No,No,New Iberia,Iberia,LA,70560
00399174,220030000159,EIGHTY-FIRST ST ECE CENTER,00398962,CADDO PARISH PUBLIC SCHOOLS,40-75% (Mid-High),"$48K-51,999",,,No,No,Shreveport,Caddo,LA,71106
00412465,220150001163,LUTCHER HIGH SCHOOL,00412415,ST JAMES PARISH SCHOOL DIST,40-75% (Mid-High),"$60K-64,999",7,12,No,No,Lutcher,St James,LA,70071
11825807,,ENCORE ACADEMY,00407068,ORLEANS PARISH SCHOOL DISTRICT,,"$28K-31,999",,8,Yes,No,New Orleans,Orleans,LA,70117
00407525,220025900897,SAMUEL J GREEN CHARTER SCHOOL,11912369,FIRSTLINE SCHOOLS INC,40-75% (Mid-High),"$60K-64,999",,8,Yes,Yes,New Orleans,Orleans,LA,70115
02105565,220027001574,T L RODES ELEMENTARY SCHOOL,00398687,BOSSIER PARISH SCHOOL DIST,40-75% (Mid-High),"$48K-51,999",,1,No,Yes,Haughton,Bossier,LA,71037
11073793,220027002080,LEGACY ELEMENTARY SCHOOL,00398687,BOSSIER PARISH SCHOOL DIST,0-40% (Low),"$48K-51,999",,5,No,Yes,Bossier City,Bossier,LA,71111
02129157,220027001573,COPE MIDDLE SCHOOL,00398687,BOSSIER PARISH SCHOOL DIST,0-40% (Low),"$48K-51,999",6,8,No,Yes,Bossier City,Bossier,LA,71111
00398912,220027000128,R V KERR ELEMENTARY SCHOOL,00398687,BOSSIER PARISH SCHOOL DIST,40-75% (Mid-High),"$48K-51,999",,5,No,Yes,Bossier City,Bossier,LA,71112
03420124,220198002012,BAINS LOWER ELEMENTARY SCHOOL,00415912,WEST FELICIANA PARISH SCH DIST,40-75% (Mid-High),"$65K-69,999",,1,No,Yes,St Francisvle,West Feliciana,LA,70775
00404042,220084000618,HAZEL PARK-HILDA KNOFF SCHOOL,00403713,JEFFERSON PARISH PUB SCH DIST,40-75% (Mid-High),"$65K-69,999",,5,No,Yes,River Ridge,Jefferson,LA,70123
00410170,220108000793,SALLIE HUMBLE ELEM SCHOOL,00410027,MONROE CITY SCHOOL DISTRICT,40-75% (Mid-High),"$48K-51,999",3,6,No,Yes,Monroe,Ouachita,LA,71201
00401404,220054000373,CAPITOL ELEMENTARY SCHOOL,00401064,EAST BATON ROUGE PARISH SD,75%+ (High),"$28K-31,999",,5,No,Yes,Baton Rouge,East Baton Rouge,LA,70802
01171030,220174001356,LISA PARK ELEMENTARY SCHOOL,00414384,TERREBONNE PARISH SCHOOL DIST,0-40% (Low),"$45K-47,999",,6,No,No,Houma,Terrebonne,LA,70364
00411772,220135001098,HOLLY RIDGE ELEMENTARY SCHOOL,00411710,RICHLAND PARISH SCHOOL DIST,75%+ (High),"$37K-38,999",,6,No,No,Holly Ridge,Richland,LA,71269
10030592,220003902013,COPPER MILL ELEMENTARY SCHOOL,05256917,ZACHARY COMMUNITY SCHOOL DIST,40-75% (Mid-High),"$70K-80,999",5,6,No,Yes,Zachary,East Baton Rouge,LA,70791
00413287,220159001228,ST MARTINVILLE PRIMARY SCHOOL,00413158,ST MARTIN PARISH SCHOOL DIST,75%+ (High),"$45K-47,999",2,5,No,No,St Martinvlle,St Martin,LA,70582
05195026,220033001543,LEBLEU SETTLEMENT ELEM SCHOOL,00399722,CALCASIEU PARISH PUBLIC SCH,40-75% (Mid-High),"$41K-42,999",,5,No,Yes,Lake Charles,Calcasieu,LA,70615
00404432,220084000639,VIC PITRE ELEMENTARY SCHOOL,00403713,JEFFERSON PARISH PUB SCH DIST,75%+ (High),"$37K-38,999",,5,No,Yes,Westwego,Jefferson,LA,70094
05273551,,LEROSEN PREPARATORY SCHOOL,00404755,LAFAYETTE PARISH SCH DISTRICT,,"$1–27,999",,12,No,Yes,Lafayette,Lafayette,LA,70501
00398558,220018000088,SINGER ELEMENTARY HIGH SCHOOL,00398443,BEAUREGARD PARISH SCHOOL DIST,40-75% (Mid-High),"$52K-54,999",,12,No,Yes,Singer,Beauregard,LA,70660
04872520,220087001176,LIVE OAK ELEMENTARY SCHOOL,00404755,LAFAYETTE PARISH SCH DISTRICT,75%+ (High),"$43K-44,999",,5,No,Yes,Lafayette,Lafayette,LA,70507
00415039,220180001399,CECIL PICARD ES-MAURICE,00414891,VERMILION PARISH SCHOOL DIST,0-40% (Low),"$65K-69,999",,5,No,Yes,Maurice,Vermilion,LA,70555
00397906,220003000022,SOUTH CROWLEY ELEM SCHOOL,00397683,ACADIA PARISH SCHOOL DISTRICT,40-75% (Mid-High),"$32K-34,999",1,5,No,No,Crowley,Acadia,LA,70526
01523067,220180001401,JESSE OWENS ELEMENTARY SCHOOL,00414891,VERMILION PARISH SCHOOL DIST,40-75% (Mid-High),"$48K-51,999",,5,No,Yes,Gueydan,Vermilion,LA,70542
03055913,220129001943,NORTHWOOD HIGH SCHOOL,00410766,RAPIDES PARISH SCHOOL DISTRICT,75%+ (High),"$32K-34,999",,12,No,No,Lena,Rapides,LA,71447
01524542,220024000102,CENTRAL ELEMENTARY SCHOOL,00415235,BOGALUSA CITY SCHOOL DISTRICT,75%+ (High),"$32K-34,999",3,6,No,Yes,Bogalusa,Washington,LA,70427
00401818,220054000416,NORTHEAST ELEMENTARY SCHOOL,00401064,EAST BATON ROUGE PARISH SD,75%+ (High),"$70K-80,999",,6,No,Yes,Pride,East Baton Rouge,LA,70770
00398508,220018000079,G W CARVER ELEMENTARY SCHOOL,00398443,BEAUREGARD PARISH SCHOOL DIST,40-75% (Mid-High),"$52K-54,999",2,3,No,No,Deridder,Beauregard,LA,70634
01170892,220174001337,BOURG ELEMENTARY SCHOOL,00414384,TERREBONNE PARISH SCHOOL DIST,40-75% (Mid-High),"$52K-54,999",,4,No,No,Bourg,Terrebonne,LA,70343
03321669,220144001987,NEW SARPY ELEMENTARY SCHOOL,00412154,ST CHARLES PARISH PUBLIC SD,40-75% (Mid-High),"$81K-93,999",,2,No,No,Destrehan,St Charles,LA,70047
00406117,220096000733,JENA JUNIOR HIGH SCHOOL,00406064,LASALLE PARISH SCHOOL DIST,40-75% (Mid-High),"$32K-34,999",6,8,No,No,Jena,La Salle,LA,71342
01827863,220153001488,EAST ST JOHN HIGH SCHOOL,00412556,ST JOHN THE BAPTIST PARISH SD,40-75% (Mid-High),"$48K-51,999",9,12,No,No,Reserve,St John The Baptist,LA,70084
00403359,220072000527,NEW IBERIA SENIOR HIGH SCHOOL,00403139,IBERIA PARISH SCHOOL DISTRICT,40-75% (Mid-High),"$35K-36,999",9,12,No,No,New Iberia,Iberia,LA,70560
00401624,220054000396,MCKINLEY MAGNET MIDDLE SCHOOL,00401064,EAST BATON ROUGE PARISH SD,40-75% (Mid-High),"$28K-31,999",6,8,No,Yes,Baton Rouge,East Baton Rouge,LA,70802
10914211,220019200947,ARTHUR ASHE CHARTER SCHOOL,11912369,FIRSTLINE SCHOOLS INC,40-75% (Mid-High),"$39K-40,999",,8,Yes,Yes,New Orleans,Orleans,LA,70122
02126351,220165001648,LITTLE OAK MIDDLE SCHOOL,00413639,ST TAMMANY PARISH SCH DISTRICT,40-75% (Mid-High),"$65K-69,999",4,6,No,Yes,Slidell,St Tammany,LA,70461
12313572,,IDEA ACADEMY-INNOVATION,00401064,EAST BATON ROUGE PARISH SD,,"$28K-31,999",,6,Yes,No,Baton Rouge,East Baton Rouge,LA,70820
00404200,220084001882,LEO E KERNER JR ELEMENTARY SCH,00403713,JEFFERSON PARISH PUB SCH DIST,0-40% (Low),"$55K-59,999",,5,No,Yes,Lafitte,Jefferson,LA,70067
00410974,220129001062,JULIUS B NACHMAN ELEM SCHOOL,00410766,RAPIDES PARISH SCHOOL DISTRICT,40-75% (Mid-High),"$48K-51,999",,5,No,No,Alexandria,Rapides,LA,71303
00407343,220025300877,PHILLIS WHEATLEY COMMUNITY SCH,11912369,FIRSTLINE SCHOOLS INC,40-75% (Mid-High),"$35K-36,999",,8,Yes,Yes,New Orleans,Orleans,LA,70119
00413342,220162002280,RAINTREE ELEMENTARY SCHOOL,00413328,ST MARY PARISH SCHOOL DISTRICT,75%+ (High),"$35K-36,999",,5,No,Yes,Baldwin,St Mary,LA,70514
11450270,220009002269,SPANISH LAKE PRIMARY SCHOOL,00398027,ASCENSION PARISH SCHOOLS,0-40% (Low),"$81K-93,999",,5,No,No,Geismar,Ascension,LA,70734
03011993,220009001862,GALVEZ PRIMARY SCHOOL,00398027,ASCENSION PARISH SCHOOLS,0-40% (Low),"$81K-93,999",,5,No,No,Prairieville,Ascension,LA,70769
00402977,220066000489,CROWVILLE SCHOOL,00402915,FRANKLIN PARISH SCHOOL DIST,40-75% (Mid-High),,,8,No,Yes,Crowville,Franklin,LA,71230
00413316,220159001231,TECHE ELEMENTARY SCHOOL,00413158,ST MARTIN PARISH SCHOOL DIST,75%+ (High),,3,5,No,No,Cecilia,St Martin,LA,70521
00399526,220030000195,SOUTH HIGHLANDS ELEM MAG SCH,00398962,CADDO PARISH PUBLIC SCHOOLS,0-40% (Low),"$48K-51,999",,5,No,Yes,Shreveport,Caddo,LA,71106
04947060,220120001527,CALHOUN ELEMENTARY SCHOOL,00410211,OUACHITA PARISH SCHOOL DIST,40-75% (Mid-High),"$55K-59,999",,2,No,No,Calhoun,Ouachita,LA,71225
00403701,220078000560,WESTON HIGH SCHOOL,00403608,JACKSON PARISH SCHOOL DISTRICT,40-75% (Mid-High),"$35K-36,999",,12,No,No,Jonesboro,Jackson,LA,71251
04886234,220003201375,V B GLENCOE CHARTER SCHOOL,00397671,LOUISIANA DEPT OF EDUCATION,75%+ (High),"$41K-42,999",,9,Yes,No,Franklin,St Mary,LA,70538
04456061,220009000463,OAK GROVE PRIMARY SCHOOL,00398027,ASCENSION PARISH SCHOOLS,0-40% (Low),"$81K-93,999",,5,No,No,Prairieville,Ascension,LA,70769
00411071,220129001052,MARY GOFF ELEMENTARY SCHOOL,00410766,RAPIDES PARISH SCHOOL DISTRICT,40-75% (Mid-High),"$48K-51,999",,6,No,No,Pineville,Rapides,LA,71360
11715513,220165002317,ABNEY EARLY CHILDHOOD CENTER,00413639,ST TAMMANY PARISH SCH DISTRICT,40-75% (Mid-High),"$60K-64,999",,,No,No,Slidell,St Tammany,LA,70458
00404365,220084000634,RUDOLPH MATAS ELEM SCHOOL,00403713,JEFFERSON PARISH PUB SCH DIST,0-40% (Low),"$60K-64,999",,8,No,Yes,Metairie,Jefferson,LA,70003
00404688,220081000569,JENNINGS ELEMENTARY SCHOOL,00404597,JEFFERSON DAVIS PARISH SD,40-75% (Mid-High),"$37K-38,999",3,6,No,No,Jennings,Jefferson Davis,LA,70546
